Title,Price,Area,Location,Description,URL
Bán nhà phố Trung Liệt Đống Đa lô góc Ngõ nông 2 thoáng 32.x 5 tầng. Sẵn sàng nội thất 10 tỷ,"10,9 tỷ",32 m²,Hà Nội,"Bán nhà Đống Đa 10 tỷ phố Trung LiệtGỐC LÕI ĐỐNG ĐA - NGÕ NÔNG BA GÁC - LÔ GÓC HAI THOÁNG - NĂM TẦNG KIÊN CỐ - NỘI THẤT SANG XỊN - 0972 879 ***      Nhà xây năm tầng khung cột bẻ tông kiên cố chắc chắn. Thiết kế hiện đại, đầy đủ công năng sử dụng  + Tầng 1: Phòng khách. Bếp  + Tầng 2, 3, 4: Mỗi tầng một phòng ngủ, vệ sinh khép kín  + Tầng 5: Phòng thờ, sân phơi Liên hệ em Hà tin đăng thật, hình ảnh thật",
"BÁN BIỆT THỰ THẠCH BÀN, LONG BIÊN DT 140M, 7 TẦNG, THANG MÁY, MT 7M, KINH DOANH, NHỈNH 32 TỶ.","32,8 tỷ",140 m²,Hà Nội,"Nhà biệt thực cực đẹp Thạch Bàn, Long Biên, diện tích 140m, mặt tiền lý tưởng 7m, 7 tầng thang máy nhập chủ xây tâm huyết từng chi tiết nhỏ, phòng cháy chữa cháy đầy đủ, nội thất cao cấp. + Sổ vuông chính chủ. -	Liên hệ ngay e: 0777 228 ***",
"Bán nhà 4 tầng. 487m2(13x37,5m). Chỉ 36 tỷ. HXH 5m 1 trục thông. 30m ra Phạm Văn Chiêu, P14, Gò Vấp",36 tỷ,487 m²,Hồ Chí Minh,"Bán nhà 4 tầng. 487m²(13x37,5m). Chỉ 36 tỷ. HXH 5m 1 trục thông. 30m ra Phạm Văn Chiêu, P14, Gò Vấp. Vị trí đắc địa, ngay ngã 4 Quang Trung - Phan Huy Ích, trường An Hội, trường Phạm Văn Chiêu, siêu thị Emart. Hiện trạng nhà trệt 3 lầu. Vừa ở vừa ở vừa cho thuê 50 triệu/tháng. Thửa đất đẹp, vuông vức. Công nhận đủ. LH:  Xuân Hoàng Nhà Đẹp.",
"NHÀ 5T PHỐ GIA THỤY, NGUYỄN VĂN CỪ, 60M2, LÔ GÓC, THANG MÁY, FULL NỘI THẤT, CHỈ 12,9 TỶ","12,9 tỷ",50 m²,Hà Nội,"Chính chủ gửi bán nhà riêng tại phường Gia Thụy, quận Long Biên. Vị trí đẹp, gần trục chính Nguyễn Văn Cừ tuyến đường huyết mạch kết nối Long Biên với Hoàn Kiếm, phố cổ Hà Nội.- Thiết kế: 5 phòng ngủ, lô góc, 2 mặt thoáng vĩnh viễn. - Trang bị: Thang máy + nội thất cao cấp đầy đủ.Công năng phù hợp gia đình đông người, vừa ở vừa làm văn phòng hoặc kinh doanh online.Vị trí vàng trung tâm khu Gia Thụy, Nguyễn Văn Cừ: Gần Nguyễn Văn Cừ, Ngọc Lâm, Bồ ...",
"Bán gấp nhà riêng tại Tây Mỗ, Hà Nội, 11 triệu VND, 45 m2 full nội thất mới xây mới cực đẹp",11 tỷ,45 m²,Hà Nội,"Nhà riêng tại Đường Tây Mỗ, Phường Tây Mỗ, Hà Nội, trước đây Quận Nam Từ Liêm, Hà Nội có thiết kế hiện đại và tiện nghi đầy đủ, phù hợp cho gia đình. Nhà có 4 tầng với 5 phòng ngủ và 4 phòng tắm, không gian rộng rãi và thoáng mát.- Diện tích 45 m² - - Giá 11 triệu VND - - Hướng cửa chính: Đông Nam - - Hướng ban công: Đông Nam - - Mặt tiền 4m - - Ngõ vào rộng 4m, thuận tiện cho xe ô tô đi lại - - Nội thất đầy đủ: điều hòa, tủ lạnh, giường... -Điểm...",
"Dành cho nhà đầu tư-Chính chủ bán căn dòng tiền Á hậu: hiện đại, hợp lý, 45m2x4,5 tầng TT Trạm Trôi",Giá thỏa thuận,42 m²,Hà Nội,"- Thị trấn Trạm Trôi, trung tâm hành chính Hoài Đức, nơi giao thông thuận lợi (Quốc lộ 32, đường Hoàng Quốc Việt kéo dài, đường Vành Đai 4... ), nơi dân cư đông đúc, tập trung các khu đô thị, Chung cư, nhiều trường học các cấp, chợ, siêu thị, nhà hàng, trung tâm thể thao, phố xá sầm uất,... Tiện ích không thiếu thứ gì.- Chính chủ bán nhà dạng chung cư mini dòng tiền mới, đẹp và chất với tầm tài chính nhỏ, vừa đầu tư cho thuê, vừa sinh lãi vốn, vừ...",
"Bán nhà 40m2, ôtô đỗ cửa, 2 mặt thoáng, cách đường chính 20m, 12 tỷ tại Trung Văn, Tố Hữu, Hà Nội",12 tỷ,40 m²,Hà Nội,"Nhà riêng đường Trung Văn - Tố Hữu, Hà Nội có diện tích Tầng 1: 40m² (ngoài ra có 30m² sử dụng chung làm sân), từ tầng 2: 45m²/ tầng, 02 mặt ngõ, thiết kế 5 tầng với 6PN, 4WC, tất cả các phòng đều có thoáng vĩnh viễn, hướng Đông Nam. Liên hệ: 0979 143 ***.Pháp lý đầy đủ, sổ đỏ sẵn sàng. Nội thất đầy đủ bao gồm điều hòa, giường, tủ... Sẵn sàng bàn giao.Ngõ rộng 4.2m, oto vào nhà, cách đường chính 20m phù hợp kinh doanh tầng 1. Giá bán 12 tỷ VND.Địa ...",
NHÀ 3 TẦNG HIỆP BÌNH TP THỦ ĐỨC DÒNG TIỀN 13TR/THÁNG,"4,5 tỷ",46 m²,Hồ Chí Minh,"NHÀ 3 TẦNG  HIỆP BÌNH  TP THỦ ĐỨC  DÒNG TIỀN 13TR/THÁNG   Giá chỉ: 4.5 TỶ (còn thương lượng)  Vị trí:  P. Hiệp Bình, TP Thủ Đức  Khu dân cư hiện hữu, an ninh, hàng xóm thân thiện  Diện tích: 6 x 7,6 m  Công nhận 48m  Kết cấu: 1 trệt 2 lầu kiên cố  Gồm: 4 phòng ngủ  4 WC (phù hợp gia đình đông người hoặc cho thuê)  Dòng tiền sẵn có: 13 triệu/tháng  đầu tư giữ tiền cực tốt  Pháp lý: Sổ riêng, công chứng ngay  Kết nối giao thông thuận tiện: Nhanh ra...",
NGỤY NHƯ KON TUM: PHÂN LÔ Ô TÔ TRÁNH VỈ HÈ NGÕ THÔNG. 2 THOÁNG. KINH DOANH. DIỆN TÍCH 55M MT 4.6M.,"35,5 tỷ",55 m²,Hà Nội,"Chính chủ giao bán căn nhà tại Ngụy Như Kon Tum giao cắt Khuất Duy Tiến, Nguyễn Tuân, Vũ Trọng Phụng, Hoàng Đạo Thúy, Lê Văn Lương... Khu phân lô ô tô tránh, dừng đỗ ngày đêm. 2 vỉ hè, sân chơi của khu.  Khu vực dân trí và tiện ích đỉnh cao. Sát vách khu liền kề Nguyễn Tuân. Kinh doanh hay ở đều tuyệt vời. Diện tích 55m mặt tiền 4.6m nở hậu 4.7m. Nhà thiết kế lệch tầng tổng 5phòng có 4 nhà vệ sinh khép kín. Sổ đỏ vuông đẹp sẵn sàng giao dịch. LH ...",
Nhà xây mới 100% đường xe hơi ngay siêu thị Emart. Gửi hoa hồng 100tr gửi anh chị em.,"8,3 tỷ",56 m²,Hồ Chí Minh,"NHÀ ĐẸP XÂY MỚI HẺM XE HƠI NGAY PHAN HUY ÍCH GÒ VẤP. Diện tích: 4m x 16m. Hướng Tây.  Kết cấu: 1 trệt 1 lửng 3 lầu. Nhà xây mới, hoàn công đầy đủ.  Công năng: Gara xe hơi, phòng khách, phòng bếp,  3 phòng ngủ, phòng thư giãn, phòng thờ, sân thượng trước sau.  Nhà full nội thất. Phan Huy Ích, P An Hội Tây (P12 Gò Vấp), Tp HCM. Hẻm xe hơi, xe hơi ngủ trong nhà.  Gần siêu thị Emart Phan Huy Ích.Giá chỉ : 8.3 tỷ (thương lượng).Liên hệ: A Vịnh 0981252...",
"Bán nhà riêng 2 tỷ 9 VND, 28 m2 tại 6L/19C Ngô Sĩ Liên, P. Phú Định, Q8, TP.HCM, giá ưu đãi","2,9 tỷ",28 m²,Hồ Chí Minh,"Căn nhà riêng tại 6L/19c Đường Ngô Sĩ Liên, Phường Phú Định, Hồ Chí Minh (cũ: Quận 8, Hồ Chí Minh) có diện tích 28m², 1 tầng, hướng cửa chính và ban công đều hướng Nam, là lựa chọn lý tưởng cho những ai tìm kiếm không gian sống thoải mái và tiện nghi.- 2PN, 1WC, 1 phòng khách, 1 nhà bếp, thiết kế hiện đại, đầy đủ nội thất. - Nội thất bao gồm: 2 điều hòa, 1 tủ lạnh, 1 máy nước nóng, 2 nệm, 2 tủ quần áo, bếp gas, 1 tủ lạnh, bàn ăn... - Pháp lý đầy ...",
"63,4M2 - 3 TẦNG - PHẠM THẾ HIỂN - 4,2x15 ( HOÀN CÔNG 130,5M2) - GIÁ 5T950","5,95 tỷ","63,4 m²",Hồ Chí Minh,"63,4M2 - 3 TẦNG - PHẠM THẾ HIỂN - 4,2x15 ( HOÀN CÔNG 130,5M2) - GIÁ 5T950 * 2 MẶT TIỀN HẺM TRƯỚC SAU , KO LỘ GIỚI , HẺM TRƯỚC NHÀ 5M , HẺM SAU NHÀ 3M  Diện tích 4,2 x 15m , có 2m sân sau , nhà có giếng trời , ban công , sân thượng , cửa sau rất thoáng  Kết cấu 3 tầng , 2pn lớn , 2wc , ban công , sân thượng , cửa sau , giếng trời , hẻm trước nhà 5m  Vị trí : Phường Bình Đông (P6 cũ ) , ngay chung cư Green River , cách quận 6 5P , thuận tiện di chu...",
"BÁN NHÀ THÁI THỊNH THỊNH QUANG, 50M2 NHÀ 5 TẦNG- FULL NỘI THẤT- 2 MẶT NGÕ TRƯỚC SAU - TRƯỚC NHÀ 3M","14,8 tỷ",50 m²,Hà Nội,"BÁN NHÀ THÁI THỊNH THỊNH QUANG, 50M2  NHÀ 5 TẦNG- FULL NỘI THẤT- 2 MẶT NGÕ TRƯỚC SAU - TRƯỚC NHÀ RỘNG 3M - TRUNG TÂM ĐỐNG ĐA.Vị trí rất đẹp, trước nhà 3m, ngõ thông tứ tung.Nhà 2 mặt ngõ trước sau, các phòng đều có cửa sổ, tặng full nội thất.Thiết kế: Tầng 1: Khách,Bếp,Vs Tầng 2 :  2 phòng Ngủ khép kín Tầng 3 : phòng ngủ, phòng thờ, wc Tầng 4 : 2 phòng ngủ, wc giữa Tầng 5:  Sân phơiPháp lý sổ đỏ chính chủ, nở hậu, cất két chờ giao dịch. Liên hệ :...",
"Rất gấp giảm sâu! ĐỘI CẤN - VĂN CAO, nhà mới ở luôn, vị trí đỉnh, 30m ôtô tránh, 37m2*5T","7,6 tỷ",37 m²,Hà Nội,"bán nhanh căn ĐỘI CẤN - VĂN CAO, (Ba Đình), nhà mới ở luôn, vị trí đỉnh, 30m ôtô tránh, 37m², 5 tầng, giá chỉ 7.7 tỷ có thương lượng. - Nhà nằm khu vực lõi Ba Đình. Từ nhà ra ô tô tránh chỉ 30m, rất gần phố. 3 phút đi bộ ra Lăng hồ Tây, 5 phút ra ga Cát Linh. Trước nhà sạch 2 thoáng vĩnh viễn, ngõ thông đi lại thuận tiện.- Khu vực dân trí cao, an ninh đảm bảo tuyệt đối. Chợ, bệnh viện, trường học các cấp, TTTM,không thiếu thứ gì.- Thiết kế hiện đ...",
"Giảm giá sốc 900tr! Nhà phố Đội Cấn, thang máy, 15m ra phố, ngõ thông, xây mới 40m*5T full NT xịn","14,57 tỷ",40 m²,Hà Nội,"SIÊU PHẨM PHỐ ĐỘI CẤN - BA ĐÌNH - MỚI ĐẸP Ở NGAY - 15M RA PHỐ ĐỘI CẤN - 200M RA LĂNG BÁC - XÂY MỚI FULL NỘI THẤT HIỆN ĐẠI - 40M - 5 TẦNG - GIÁ 14.57 TỶVị trí cực đỉnh - trung tâm Ba Đình đi bộ ra quảng trường Ba Đình, Lăng Bác, chùa Một Cột, bến xe Kim Mã, Hồ Tây... Thiết kế hiện đại sang trọng, nội thất nhập khẩu...n + Tầng 1: khách, bếp. + Tầng 2, 3, 4 mỗi tầng 1 phòng, wc. + Tầng 5: 1 phòng nhỏ, sân phơi.Sổ đỏ chính chủ giao dịch ngay. Liên hệ...",
"2x Tỷ | 63,5m2 Phố Bồ Đề - Nhà Mới Hoàn Thiện Năm 2022 - 7 Tầng, Có Thang Máy - 2 Ô Tô Vào Nhà",Giá thỏa thuận,"63,5 m²",Hà Nội,"Gia đình tôi cần bán căn nhà đang sinh sống để lên chung cư, hoàn thiện 7 tầng, có thang máy, nhà xây xong và bắt đầu ở từ năm 2022.  - Ngõ 2 ô tô tránh, tầng 1 để được 2 xe ô tô nhỏ.  - Diện tích 63,5m², mặt tiền gần 6m, sâu hơn 11m, 7 tầng - Nhà vuông vắn, không lỗi phong thuỷ. - Đường thông, ngõ thoáng, cách 80m ra mặt đường Nguyễn Văn Cừ (đã đo cụ thể) - 500m ra cầu Chương Dương.  - Nhà hoàn thiện năm 2022, nội thất và thiết bị điện tử gần nh...",
Nhà chính chủ hẻm 88 Nguyễn Văn Quỳ Quận 7,"6,9 tỷ",56 m²,Hồ Chí Minh,"Nhà chính chủ hẻm 88 Nguyễn Văn Quỳ Quận 7. ============== Hoa hồng gởi ACE giới thiệu 2% nhận đủ. - Diện tích: 4x16m. - Kết cấu: Trệt 2 lầu sân thượng. - Gồm 4 phòng ngủ, trong đó có phòng master rộng rãi và đủ tiện nghi, 5 nhà vệ sinh. - Nhà thiết kế nội thất và tone màu nhẹ nhàng, tinh tế và sang trọng, mang đến cho gia chủ cảm giác thư thái và thoải mái. - Tặng full nội thất như sofa, bàn ăn, máy lạnh, phòng ngủ có giường nệm, tủ quần áo, tab...",
"BÁN NHÀ MỚI SIÊU ĐẸP, BAN CÔNG THOÁNG NGẮM THÀNH PHỐ NGAY CHỢ LIÊN KHU 5.6","5,4 tỷ",50 m²,Hồ Chí Minh,"Nhà hẻm xe hơi 6m thông đường số 8 và đường số 6. cách 200m ra chợ . dtich đất 4m x 12.5m . 3 tầng, sân thượng trồng cây, dtich sdung 200m² . 4 phòng ngủ, 4 toilet, một sân thượng lớn view thành phố . nhà mới, đẹp, dọn vào ở ngay",
"BÁN NHÀ THỔ CƯ 3,5 TẦNG ĐÀN VIÊN CAO VIÊN | GẦN HÀ ĐÔNG | NHÀ ĐẸP Ở NGAY GIÁ NHỈNH 4 TỶ",Giá thỏa thuận,42 m²,Hà Nội,"Chính chủ gửi bán căn nhà thổ cư 3 tầng tại Đàn Viên, Cao Viên  vị trí đẹp, khu dân cư yên tĩnh, an ninh tốt.Chỉ cách Hà Đông khoảng 4km  di chuyển thuận tiện đi làm mỗi ngày Ngõ trước nhà rộng 2,5m, ô tô đỗ cách nhà chỉ 10mƯu điểm nổi bật: Nhà xây kiên cố, chắc chắn, thiết kế hiện đại tối ưu công năng Căn góc thoáng sáng, phòng nào cũng có cửa sổ đón ánh sáng tự nhiên Hàng xóm thân thiện, dân trí cao, môi trường sống văn minhThiết kế công năng: ...",
"Đắt khách! Nguyễn Khang, ngõ thông kinh doanh tốt, mặt tiền rộng, sổ vuông đẹp, 4 ngủ, 45m2, 5T",9 tỷ,45 m²,Hà Nội,"Phố Nguyễn Khang Diện tích 45m², xây 5 tầng dân xây chắc chắn, 4 ngủ rộngMặt ngõ thông, kinh doanh thuận lợiGần ô tô, đi lại tiện lợiMặt tiền rộng hiếm, thoáng sángSổ vuông đẹp hoa hậu, pháp lý chuẩnGiá chỉ nhỉnh 9 tỷLiên hệ Mr Chung 0862 565 *** xem nhà miễn phí.",
Cần bán gấp căn nhà ở phong phú 4 bình Chánh,838 triệu,100 m²,Hồ Chí Minh,"Bán nhà 1 trệt 1 lầu  3PN KDC Phong Phú 4 Bình Chánh* DT: 5 x 20 ( 100m²)  * Kết cấu: 3PN  2WC  phòng khách  bếp * Đường 8m, xe hơi vào tận nhà * Sổ hồng riêng, hoàn công đầy đủ * Khu dân cư an ninh, gần chợ  trường học Giá:  (còn thương lượng) Lh : 0967 524 *** ( xem nhà trực tiếp)",
"Nhà 268 m2 chỉ 60 triệu/m Không còn căn thứ 2, Phú Thuận hẻm xe tải 6m",16 tỷ,168 m²,Hồ Chí Minh,"Cơ Hội Vàng,giá tốt trong khu vực giáp Phú Mỹ Hưng! Giá sẽ tăng nhanh!  	Mặt tiền hẻm 6m Chuyên Dùng 9, 168/268m², 6 phòng 1 tầng, 8.6*33m  Chỉ 16 tỷ (TL). #12 	SHR  Hoàn công  chủ nhiệt tình, hỗ trợ vay bank. 	Chủ cần giải quyết nhu cầu tài chính nên nhiệt bán, khu xây tự do nhiều hộ kinh doanh CHDV 	Xem nhà ngay hôm nay  inbox em ạ! 	Khu cao ráo không ngập, phù hợp xây biệt thự hay căn hộ dịch vụ cao cấp. --- Chuyên mua bán nhà phố Quận 7, chỉ ...",
Bán nhà SHR KO QUY HOẠCH KO LỘ GIỚI,"2,8 tỷ",47 m²,Hồ Chí Minh,"Nhà SHR qua Gò vấp 3p , giáp Thủ Đức, Bình dương , BHX, chợ Cầu đồng.",
"Bán CHDV tại 192 đường Kim Giang, Định Công, DT 66m2, 7 tầng, 21 phòng ngủ khép kín, dòng tiền tốt","20,5 tỷ",66 m²,Hà Nội,"Bán căn hộ dịch vụ, dòng tiền tốt tại ngõ 192 đường Kim Giang, phường Định Công, Hà Nội. Liên hệ đi xem vị trí. Mô tả: CHDV có diện tích 66m², xây dựng 7 tầng bao gồm 21 phòng ngủ khép kín, mặt tiền 5m hướng nhà Tây Bắc, đã trang bị PCCC, giấy phép hoạt động đầy đủ. (Ảnh chụp thực tế 1 số phòng bên trong căn hộ). - Hiện tại đã cho thuê full phòng, dòng tiền ổn đinh. CHDV chỉ cách đường Kim Giang 300m, đường trước nhà 2m. - Năm tại vị trí đắc địa,...",
"Bán căn nhà đất diện tích 140m2, có nhà 3T, 6PN tại đường Bưởi, Ngọc Hà, SĐCC, giá bán 27 tỷ có TL",27 tỷ,140 m²,Hà Nội,"Bán nhà đất 2 mặt thoáng vị trí đắc địa, cơ hội lớn cho các nhà đầu tư quan tâm. Mô tả: Nhà 2 mặt thoáng ngõ 462 đường Bưởi, diện tích 140m², nhà cũ 3 tầng diện tích xây dựng 80m²/ sàn, tổng 6 phòng ngủ. Trước nhà là khoảng sân rộng tới 60m với mặt tiền 4m có hướng Đông Bắc, mặt thoáng có hướng Tây Bắc. Nhà đất nở hậu phong thuỷ tốt. (ảnh chụp thực tế). - Đường trước nhà 2,5m và có quy hoạch mở rộng lên tới 6m(không ảnh hưởng tới lô nhà đất), các...",
"Bán NR hẻm 110, đường Số 30, Quận Gò Vấp, giá ưu đãi 9,5 tỷ, 60m2","9,5 tỷ",60 m²,Hồ Chí Minh,"Đây là căn nhà riêng cực chất tại hẻm 110, Đường Số 30, Phường An Hội Đông, Hồ Chí Minh - Quận Gò Vấp, Hồ Chí Minh cũ, với diện tích 60m², 2 tầng, 3PN và 2WC. Nội thất cơ bản, sẵn sàng cho cuộc sống mới.+ Giá chỉ 9,5 tỷ VND, siêu hời cho khu vực này! + Mặt tiền rộng 10m, cực đẹp và dễ dàng cho việc kinh doanh. + Hướng cửa chính Bắc, ban công Đông, phong thủy tốt. + Ngõ vào rộng 8m, xe hơi vào thoải mái. + Pháp lý đầy đủ, yên tâm về mặt giấy tờ.Đị...",
"660tr mặt tiền hẻm QH khu dân cư full hồng thổ cư, ở nhà máy Tiger Q12 đường Lê Văn Khương",660 triệu,"12,6 m²",Hồ Chí Minh,"Nhà khu dân cư đông đúc, nhà liền nhà Mặt tiền hẻm thông 119 đường Lê Văn Khương - HT35 - HT48 - Nguyễn Thị Kiểu - HT33 Hẻm thông, khu hoạt sầm uất, đối diện nhà máy bia Tiger, Heniken Giá đầu tư chỉ 660 triệu, chủ dễ thương, có thương lượng nhẹ nhanh và gọn Hiện trạng nhà 1 trệt 1 lửng 1 toilet, có hỗ trợ decor thiết kế miễn phí cho gia đình nào muốn nâng cấp thành 1 trệt 1 lầu 2 phòng ngủ ạ (chi phí vật tư, thi công người mua chịu) Liên hệ xem ...",
BÁN NHÀ XUÂN LA 60M2 5 TẦNG - PHÂN LÔ - VỈA HÈ - 2 THOÁNG VĨNH VIỄN - Ô TÔ TRÁNH - VÀO NHÀ,"23,2 tỷ",60 m²,Hà Nội,"Cơ hội sở hữu bất động sản đẳng cấp tại khu vực đáng sống nhất Quận Tây Hồ. Nhà nằm trong khu phân lô cán bộ, dân trí cao, hạ tầng đồng bộ, giao thông cực kỳ thuận tiện.Vị trí đắc địa: Thuộc khu phân lô Xuân La, đường trước nhà rộng rãi, có vỉa hè, ô tô tránh nhau thoải mái.Môi trường sống: Không khí trong lành từ Hồ Tây, tiện ích xung quanh không thiếu thứ gì: trường học các cấp, bệnh viện, trung tâm thương mại Lotte Mall...Sổ đỏ: Chính chủ, phá...",
"Bán nhà riêng Xuân Diệu 110m2, 8 tầng, mặt tiền 9m, phù hợp cho gia đình lớn hoặc đầu tư sinh lời.",46 tỷ,110 m²,Hà Nội,"Nhanh tay sở hữu căn nhà riêng tại đường Xuân Diệu, phường Quảng An, quận Tây Hồ, Hà Nội. Căn nhà có diện tích 110m², 8 tầng, mặt tiền rộng 9m, phù hợp cho gia đình lớn hoặc đầu tư sinh lời.+ Giá bán: 47 tỷ VND. + Pháp lý đầy đủ, sổ đỏ, sổ hồng. + Thiết kế hiện đại, không gian sống thoáng đãng.Ưu điểm: - Phong thủy tốt, mang lại tài lộc cho gia chủ. - Mặt tiền rộng, thuận lợi cho việc kinh doanh hoặc cho thuê.Địa điểm tiện ích xung quanh: - Gần c...",
Bán nhà Hai Bà Trưng dưới 8 tỷ  ngõ thông  sổ vuông  cực dễ mua,"7,9 tỷ",33 m²,Hà Nội,"BÁN GẤP Nhà Trương Định  Ngõ Thông Nguyễn An Ninh  MT Rộng  trên 4m  3.5 Tầng  Vị trí trung tâm  kết nối cực thuận tiện Địa chỉ: Số 1, ngách 19, ngõ 158 Trương Định  Hai Bà Trưng Ngõ thông sang Nguyễn An Ninh  đi lại linh hoạt, cực tiện Khu dân cư đông, gần chợ  trường học  tiện ích đầy đủ  Thông tin chi tiết Nhà 3.5 tầng, kết cấu chắc chắn Móng khỏe  có thể lên thêm 4.5 tầng thoải mái Mặt tiền: hơn 4m (hiếm trong tầm giá) Sổ đỏ: vuông đẹp  chính...",
"Bán nhà phân lô ngõ 167 Tây Sơn - đại học Công Đoàn. Ngõ thông ô tô vào nhà, đang cho thuê gần 30T","23,6 tỷ","71,9 m²",Hà Nội,"Vị trí: Nhà ở số 47, ngách 15, ngõ 167 Tây Sơn (ngõ thông ô tô, có thể đi vào từ ngách 15 hoặc ngách 25). Ô tô vào tận nhà hoặc đỗ ngay trước cửa. Giao thông cực kỳ thuận tiện ra Thái Hà, Chùa Bộc, Tôn Thất Tùng, Trường Chinh. Khu vực dân trí cao, an ninh tốt, trước nhà là trường Đại học Công Đoàn, đông đúc sinh viên, có khuân viên cây xanh của trường rất rộng rãi để tập thể dục, sân chơi trẻ em. Thông tin chi tiết: Diện tích: 71,9m². Mặt tiền: 4...",
NHÀ ĐẸP TÔ HIỆU HOÀ BÌNH 77m ĐƯỜNG THÔNG XE TẢI 4PN LỚN CHỈ 8TỶ2,"8,25 tỷ",77 m²,Hồ Chí Minh,". Diện tích 77m ( 4,3 x 18m ) vuông vức  . vị trí VIP Tô Hiệu Hoà Bình dân trí cao tiện ích đầy đủ  . 1 trệt 2 lầu 4PN chủ xây kiên cố  . Sổ Hồng riêng mua bán nhanh  Gọi e phương xem nhà",
"Bán nhà 3 tầng KP, Trảng Dài, Biên Hòa","3,5 tỷ",60 m²,Đồng Nai,"Di dời về Sài Gòn. Chính chủ cần bán nhà mới KP3 Trảng Dài, Biên Hòa, Đồng Nai. Giá 3,5 tỷ (0979 089 *** chính chủ). Nhà 1 trệt 2 lầu, sân thượng mái tôn full. Ô tô 7 chỗ đậu trong nhà. 4 phòng ngủ và 2 khu sinh hoạt gia đình (lầu 1 và lầu 2), 4 WC. Đồng hồ điện nước máy riêng, máy nước nóng NLMT. Đã gắn sẵn máy lạnh, giường, tủ quần áo 2 phòng, internet, Cam... Cách đường Đồng Khởi 200m. Khu vực an ninh, phù hợp gia đình trẻ và người lớn tuổi. Do ...",
"Siêu hiếm, Hoàng Văn Thái, 39m2, 5 tầng, 40m ra mặt phố, giá 8,9 tỷ (Cam kết nhà thật giá chuẩn)","8,9 tỷ",39 m²,Hà Nội,"- Phân lô quân đội siêu hiếm - Ngõ thông - Gần phố - Lô góc siêu hiếm - Nhà dân xây chắc chắn - Thiết kế: + Tầng 1: Phòng khách, bếp, WC. + Tầng 2: 1 phòng ngủ, 1WC. + Tầng 3: 1 phòng ngủ, 1WC. + Tầng 4: 1 phòng ngủ, 1WC. + Tầng 5: Phòng thờ, sân phơi. - Sổ đỏ chính chủ sẵn sàng giao dịch. Quý khách có nhu cầu liên hệ tôi Duy Khánh (1981) SĐT 0912 588 *** để xem nhà và tìm nhà theo yêu cầu quý khách.",
"Nhà Hoàng Diệu 118m² 7 căn hộ đang cho thuê, dòng tiền ổn định",8 tỷ,118 m²,Đà Nẵng,"Cơ hội đầu tư siêu hời nhà có sẵn dòng tiềnĐịa chỉ: 197/1 Hoàng Diệu trung tâm thành phố Diện tích: 118m², 3 tầng ,7 phòng Nhà thiết kế hiện đại, thoáng mát, nằm trong khu dân cư yên tĩnh, gần trường học, cách cầu rồng 1,5km  Hiện đang khai thác 7 phòng căn hộ cho thuê có sẵn dòng tiền ổn định mỗi tháng Phù hợp vừa ở vừa đầu tư, hoặc tiếp tục khai thác cho thuê dài hạnHẻm vào thuận tiện, khu vực trung tâm, dễ di chuyển Không gian sạch sẽ, có sân ...",
CHDV - 14 phòng - 140m2 - vip Dương Bá Trạc - dòng tiền 630tr/năm - 14. x tỷ TL,"14,5 tỷ",140 m²,Hồ Chí Minh,"CHDV - 14 phòng - 140m² - vip Dương Bá Trạc - dòng tiền 630tr/năm - 14. x tỷ TL.- Diện tích 140,2m², 5.5x23m, 4 tầng. - Xây dựng 1 trệt 2 lầu, sân thượng, máy nước nóng năng lượng mặt trời. - Gồm: 14 phòng, 14WC, mỗi phòng đều có wc, máy lạnh,... - Có sàn để xe hơn 20 chiếc. Trang bị sẵn PCCC, hệ thống nước nóng năng lượng. - Có thể khai thác thêm phòng sân thượng cho thuê tăng dòng tiền.Vị trí: - Cách mặt tiền đường nhựa chỉ 15m. 2 phút ra quận ...",
"Nhà phố Akari Võ Văn Kiệt 7 tỷ, xây 5 tầng, sổ đỏ, thanh toán tiến độ từ 2,3 tỷ, tháng 6 nhận nhà",7 tỷ,56 m²,Hồ Chí Minh,"- Em có căn góc vuông vức, đường vỉa hè rộng, siêu ưng cặp sát vách dự án Akari Bình Tân - tiện ích sầm uất cao cấp. Anh chị mua hưởng trọn tiện ích. - Thanh toán theo tiến độ hiện tại là 30%, dự kiến tháng 6/2026 nhận nhà. - Sổ đỏ từng nền, xây sẵn 1 trệt, 4 lầu, hoàn thiện mặt ngoài theo form Nhật Bản. - CDT đến từ Nhật Bản. - Giá trị thanh khoản cao vì được ck từ 7% - 10%. - Ngân hàng hỗ trợ 60%, ngân hàng Bidv ưu đãi lãi suất tốt. - Khu compo...",
"Bán toà 18 căn Studio, thoáng trước sau, phố Hào Nam, 78m2*7T, thang máy, ngõ nông, DT 100tr/tháng","16,5 tỷ",78 m²,Hà Nội,"BÁN TOÀ CHDV HÀO NAM - GẦN GA CÁT LINH - 2 THOÁNG VĨNH VIỄN - NGÕ NÔNG - SH QUAY ĐẦU - 18 PHÒNG KHÉP KÍN - DÒNG TIỀN 100TR/THÁNG - PHÒNG NÀO CŨNG CÓ CỬA SỔ - THANG MÁY - PCCC - QH ỔN ĐỊNH+ Diện tích 78m² xây 7 tầng thang máy, GPXD, PCCC đầy đủ. Chào bán 16.5 tỷ ( có thương lượng sâu). + Khu vực nhu cầu nhà ở cao, gần ngiều trường Đại học lớn như: Nhạc viện Hà Nội, Đại học Văn Hoá, Đại học Giao Thông Vận Tải, gần ga tầu điện Cát Linh - Hà Đông, cá...",
