Title,Price,Area,Location,Description,URL
"Bán nhà Đ. Cô Giang Q1 nở hậu 5,3m, mặt tiền hẻm oto view đẹp chỉ với 8,8 tỷ","8,8 tỷ",60 m²,Hồ Chí Minh,"Nhà riêng Đường Cô Giang, Q1 với diện tích 60m², thiết kế 2PN + 2WC + bếp, rất phù hợp cho gia đình. Giá bán 8,9 tỷ VND, pháp lý đầy đủ. Nội thất đầy đủ với điều hòa, giường, tủ lạnh, và nhiều tiện nghi khác.Ngõ vào rộng 4m, thuận lợi cho xe ô tô ra vào, mặt tiền 4m thích hợp cho việc kinh doanh.Địa điểm xung quanh - Bệnh viện: Bệnh viện Răng Hàm Mặt TP. HCM, Bệnh viện 30-4, Bệnh viện Bệnh Nhiệt Đới - Siêu thị: Winmart+, Siêu thị Jmart, Siêu thị ...",
"Chính chủ cần bán gấp phân lô quân đội, gara ôtô - Triều Khúc, Thanh Xuân - 54m2 - 17,5 tỷ (TL)","17,5 tỷ",54 m²,Hà Nội,"Gia đình tôi cần chuyển nhượng lại phân lô ôtô quân đội với thông số như sau: - Diện tích 54m², mặt tiền 4m. - Thiết kế 4 tầng, 4 phòng ngủ, 3 vệ sinh: Tầng 1: Gara ô tô, phòng bếp, vệ sinh rộng. Tầng 2,3: Mỗi tầng 2 phòng ngủ, wc ở giữa. Tầng 4: Phòng thờ, sân phơi. Nhà xây để ở nên rất chắc chắn, có thể lên tầng (móng chắc chắn có thể lên 7 tầng) thiết kế hợp lý thoáng trước, sau. Nhà phù hợp để ở, kinh doanh, văn phòng... Anh chị xem nhà liên ...",
"Nhà phố liền kề KCN lớn nhất Việt Nam chỉ từ 600tr, khai thác ngay 12 - 15tr/tháng","1,56 tỷ",60 m²,Tây Ninh,"Cơ hội sở hữu nhà phố 1 trệt 2 lầu 148m² tại Phước Đông New City khu đô thị nằm ngay trung tâm KCN Phước Đông (Tây Ninh), nơi tập trung hàng chục nghìn chuyên gia & lao động.Vì sao nhà đầu tư đang xuống tiền nhanh?Pháp lý hoàn chỉnh. Sổ hồng riêng từng căn. Đã hoàn công nhận nhà ngay.Giá cực tốt chỉ từ 1.56 tỷ/căn 2 tầng. Đã bao gồm VAT & phí sang tên. Diện tích SD 148m², 4PN 3WC phòng khách bếp rộng.Dòng tiền khai thác ngay. Cho thuê ổn định: 12...",
"Chính chủ bán nhà HXH Cửu Long,Phường 2 Q.Tân Bình. [DT 4.6x15m], KC 5tầng (9PN+9WC thang máy )","18,9 tỷ",65 m²,Hồ Chí Minh,"* Chính chủ Bán nhà Cửu Long Phường 2, Tân Bình. - Nhà 5 tầng thang máy 9 phòng khai thác 80tr/tháng. + Địa chỉ: Cửu Long, P. 2, Q. Tân Bình. + Diện tích: 4.6x 15m (65m²). + Kết cấu: 5 tầng, có thang máy, tổng 9PN 9WC. * Dòng tiền cho thuê: 80 triệu/tháng. + Khu vực sân bay đầy nhu cầu thuê, ít rủi ro trống phòng. + Tòa nhà mới phù hợp giữ tài sản + tăng trưởng giá trị theo thời gian. * Giá bán: 18.9 tỷ (Thương lượng chính chủ thiện chí bán).  * ...",
"SIÊU PHẨM HOÀNG NHƯ TIẾP, 103M2, MẶT TIỀN RỘNG 5.7M, GARA Ô TÔ, FULL NỘI THẤT TIỀN TỶ, CHỈ 23,7 TỶ","23,7 tỷ",103 m²,Hà Nội,"Chính chủ gửi bán: Nhà đẹp phố Hoàng Như Tiếp ngõ thông Hồng Tiến, trung tâm phường bồ đề Long Biên, gần Nguyễn Văn Cừ, kết nối nhanh cầu Chương Dương, cầu Vĩnh Tuy, tương lai gần Cầu Trần Hưng Đạo giúp tăng giá mạnh, chỉ 5 phút sang phố cổ.Thiết kế hiện đại, 2 mặt thoáng trước sau, ở cực sướng, -  Tầng 1, gara ô tô, khách, bếp -  Tầng 2, 2 phòng ngủ rộng, giếng trời -  Tầng 3, 1 ngủ, phòng xông hơi, tắm bồnNội thất tiền tỷ, ở ngay, kết cấu chắc ...",
"BÁN NHÀ NGÕ 390 NGỌC THỤY, LONG BIÊN | 4.5 TẦNG  37M²  NỞ HẬU  GIÁ 8.3 TỶ, 0989 849 ***","8,3 tỷ",37 m²,Hà Nội,"BÁN NHÀ NGÕ 390 NGỌC THỤY, LONG BIÊN | 4.5 TẦNG  37M²  NỞ HẬU  GIÁ 8.3 TỶGiá bán: 8.3 tỷ (có thương lượng)Thông tin chi tiết:Diện tích: 37m² Mặt tiền: 3.6m  nở hậu (phong thủy tốt) Kết cấu: 4.5 tầng kiên cố Nhà đầy đủ tiện nghi, vào ở ngayVị trí:Ngõ 390 đường Ngọc Thụy, Phường Ngọc Thụy (cũ), quận Long Biên Phường Ngọc Thụy (mới), quận Long Biên, Hà Nội Ngõ thông thoáng, dân cư văn minh Kết nối nhanh sang trung tâm Hoàn Kiếm qua cầu Long Biên, Ch...",
"Chính chủ 100% cần bán nhà CCMN CHDV tại ngõ 66 Võng Thị Tây Hồ, DT 97m2 , MT 5,7m, 21 phòng. 35 tỷ",35 tỷ,97 m²,Hà Nội,"Chính chủ cần bán toà nhà chung cư mini MỚI XÂY tại ngõ 66 Võng Thị DT 97m² , MT 5,7m, 21 phòng, thang máy, PCCC đầy đủ. giá 35 tỷ- Nhà mới xây 1 năm DT 97m², MT 5,7m, ngõ trước nhà 2.5M, 21 phòng. - Nhà 2 mặt thoáng trước sau,đường trước mặt 2,5m, cách đường ôtô 70m.  - Có quy hoạch nhà ra mặt đường, khi xây nhà đã làm theo xây dựng của nhà mặt đường. - Sân thựợng view Hồ Tây 300m. - Trang bị đầy đủ tủ lạnh, Điều hoà, bếp,máy hút mùi, máy giặt, ...",
BÁN NHÀ KINH DƯƠNG VƯƠNG QUẬN BÌNH TÂN 60m2 SHR,"1,75 tỷ",60 m²,Hồ Chí Minh,"Chủ gửi bán căn nhà Bình Tân đang ngộp   - Địa chỉ : Hẻm 2/ đường Kinh Dương Vương quận Bình Tân.  GIÁ 1 Tỷ 750 triệu ( không thương lượng )   60m² ( 4m x 15m) Kết cấu: 1 phòng khách  2 phòng ngủ  bếp 2  WC  Điện nước đầy đủ, dọn vào ở ngay  Khu dân cư hiện hữu, an ninh kinh doanh buôn bán nhỏ lẻ.  Sổ riêng hoàn công đầy đủ Xem nhà liên hệ trực tiếp không qua cò lái",
Siêu phẩm đầu tư dòng tiền. Nhà mới hẻm 1428/1 DT 5m x 13.5m 3 tầng 7 phòng. Dòng tiền 20tr/1tháng,"3,99 tỷ","66,7 m²",Hồ Chí Minh,- Bán nhà hẻm 1428/1 Huỳnh Tấn Phát Q7. - Diện tích: 5m x 13.5m (CN: 66.7m²). - Kết cấu: 3 tầng. - Có 7 phòng đang cho thuê. - Dòng tiền ổn định 20tr/1thang. - Nội thất có sẵn... Khóa vân tay. Máy lạnh. Máy giặt vvv. - Vị trí: Cách mặt tiền Huỳnh Tấn Phát khoảng 50m. - Pháp lí: Sổ hồng riêng. Hỗ trợ vay. - Giá 3.990 tỉ còn thương lượng. Liên hệ: 0865 949 *** xem nhà trực tiếp.,
"Chính chủ giảm 1 tỷ, bán nhà riêng 42/54 đường Nguyễn Giản Thanh, Q10, còn 12.9 tỷ, 56m2","12,9 tỷ",56 m²,Hồ Chí Minh,"Nhà riêng tại số 42/54, đường Nguyễn Giản Thanh, Phường Hòa Hưng, Hồ Chí Minh (địa chỉ cũ: Quận 10, Hồ Chí Minh) với diện tích 56m², 4PN + 5WC, hướng Tây Bắc, mặt tiền 3,3m, ngõ rộng 8m, pháp lý đầy đủ. Giá bán 12,9 tỷ VND. Phù hợp cho gia đình hoặc đầu tư kinh doanh.- Đặc điểm: + DT: 3,3 x 17m = 56m². + Trệt + 3 lầu đúc BTCT. + 4 phòng ngủ, 5 phòng tắm. + Hẻm nhựa ô tô 8m, ngay chợ sỉ thuốc tây quận 10. + Mặt tiền phù hợp cho việc kinh doanh tiệ...",
"THÍCH QUẢNG ĐỨC P4 PHÚ NHUẬN - dt 30m2 - 4 TẦNG - 3 pn - giá : 5,35 tỷ","5,35 tỷ",30 m²,Hồ Chí Minh,"Hàng mới 120/Thích quảng Đức quận Phú nhuận trệt bốn lâu giá 5tỷ350. M Hàng hiếm khó tìm  (1551)DT:3,5m  x 6,8m .TDTSD:100m.trệt bốn tầng,3PN,4WC.Sân thượng chill ngắm trăng và sao   Vi trí đẹp hẽm 3m cách HXH 10m.Khu dân trí cao  Sổ hồng chính chủ hoàn công đầy đủ.Pháp lý chuẩn chỉnh công chứng trong ngày  Hoàng Hồ",
"PHẢI NHANH MỚI KỊP Ạ !
SIÊU HIẾM Giáp Q1 ~ 4 tỷ TL Hoàng Hoa Thám Phường 6 Bình Thạnh",5 tỷ,40 m²,Hồ Chí Minh,"PHẢI NHANH MỚI KỊP Ạ ! SIÊU HIẾM  Giáp Q1 ~ 4 tỷ TL   Hoàng Hoa Thám Phường 7 Bình Thạnh ~ 40m² - 4 Tầng Đúc - Gần Mặt tiền  1 Trệt 3 lầu ban công ( 5 Phòng Ngủ 4 Wc ) có thể làm thành 6 Phòng ngủ  Chủ Tặng Toàn Bộ Nội Thất ( 1 máy lạnh 2 ngựa, 4 Máy lạnh 1,5 ngựa, Máy giặt, bếp, máy hút mùi, )  NgAY bệnh Viện Gia Định, Giáp Phú Nhuận Hẻm sạch sẽ An ninh, dân trí cao  Sổ hồng riêng, hoàn công đủ, công chứng ngay.",
"Dòng tiền Q10 chủ giảm 2.5 tỷ, 001","13,99 tỷ",60 m²,Hồ Chí Minh,"Hẻm 6.5m thông, sát mặt tiền. DT 60m² thông thủy 59m², nở hậu 9m đẹp phong thủy. 5 tầng BTCT, 10 phòng master khép kín, đang cho thuê dòng tiền ổn định. Gần chợ đêm Hồ Thị Kỷ, ĐH Bách Khoa Sư Phạm Kinh Tế Y Dược. Giá 13.990 tỷ chốt trong tháng 4/2026 Sổ hồng riêng hoàn công đủ công chứng ngay.",
"Tòa chung cư mini Văn Cao, 2 thoáng, 19 phòng, DT ~1.5 tỷ/năm, ba gác thông, 20m ra ô tô, 80m2","16,5 tỷ",80 m²,Hà Nội,"Bán tòa chung cư mini dòng tiền tại Văn Cao Ba Đình, khu vực trung tâm, dân trí cao, nhu cầu thuê cực lớn, đặc biệt khách nước ngoài chuyên gia.Thiết kế 80m² x 8 tầng, tổng 19 phòng khép kín full đồ, nhà xây mới hiện đại, 2 mặt thoáng phòng sáng đẹp, full PCCC + GPXD.Ngõ rộng, ba gác thông, chỉ 20m ra ô tô, kết nối nhanh Liễu Giai, Đào Tấn, Kim Mã, Thụy Khuê, Hồ Tây,Khu vực gần Lotte, Vincom, các Đại sứ quán, văn phòng quốc tế, nhu cầu thuê cao c...",
Siêu phẩm  5m ra mặt phố  Hiếm cực kỳ  6 tầng thang máy  Ở ngay,"15,5 tỷ",55 m²,Hà Nội,"Mặt sau thoáng vĩnh viễn  Nhà đẹp long lanh  Kinh doanh online đỉnh caoVị trí vàng, chỉ 5m ra mặt phố  tiếp cận nhanh, cực kỳ dễ bánMặt sau thoáng vĩnh viễn, ở cực sướng, phòng nào cũng có ánh sáng tự nhiênSát mặt phố, phù hợp kinh doanh online mọi mô hìnhNhà 6 tầng thang máy, xây dựng tâm huyết, ở luôn không cần sửaThiết kế tối ưu: Tầng 1: Phòng khách + để xe Tầng 2, 3, 4: Mỗi tầng 2 phòng ngủ Tầng 5: Bếp + phòng khách phụ Tầng 6: Sân phơi + khu...",
"Bán nhà Tây Sơn - Thái Thịnh, 45m2 x7T, thang máy, 30m ra phố, đủ nội thất, 14.4 tỷ (MÃ-99)","14,4 tỷ",45 m²,Hà Nội,"Diện tích: 45m² x 7 tầng + thang máy.*Giá chào: 14.4 tỷ (có thương lượng).*Vị trí trung tâm Đống Đa, giao thông thuận tiện, di chuyển dễ, nằm gần các khu vực: Thái Hà, Hoàng Cầu, Láng Hạ, Tây Sơn,*Xung quanh nhiều tiện ích & trường học: Vincom, Royal city, Trường C1-2-3-quốc tế đều có, Học Viện Ngân Hàng, ĐH Công Đoàn, ĐH Thuỷ Lợi, ĐH Y Hà Nội,Thiết kế: 7 tầng - nội thất cao cấp - thang máy nhập khẩu  Tầng 1: Phòng khách, WC.  Tầng 2-3-4: Phòng n...",
"Bán nhà phố Nguyễn Chí Thanh, Đống Đa, lô góc ô tô 52m 5 tầng 31 tỷ",31 tỷ,52 m²,Hà Nội,"Bán nhà phố Nguyễn Chí Thanh  trung tâm quận Đống Đa, vị trí đẹp, khu phân lô cán bộ, dân trí cao. Diện tích 52m, mặt tiền 5.2m, xây 5 tầng chắc chắn Nhà dân xây khung cột bê tông, bền vững theo thời gian Thiết kế công năng hợp lý: Tầng 1: Phòng khách + bếp + để xe + WC Tầng 2: 1 phòng ngủ + WC Tầng 3,4: Tổng 4 phòng ngủ khép kín Tầng 5: Phòng thờ + sân phơi Ưu điểm nổi bật: Lô góc 2 mặt thoáng, ô tô vào nhà Gần mặt phố Nguyễn Chí Thanh, giao thô...",
"Bán nhà - Nghĩa Đô - Cầu Giấy. 46m2 x 5 tầng, nhà đẹp, mặt ngõ thông, 25 m ra ô tô, full nội thất","9,2 tỷ",46 m²,Hà Nội,"Bán nhà - Nghĩa Đô - Cầu Giấy. 46m² x 5 tầng, nhà đẹp, mặt ngõ thông, 25 m ra ô tô, full nội thất.+ Vị trí cực đẹp trung tâm Cầu Giấy, nhà nằm ở mặt ngõ, trước nhà rộng 3 m. Rất thoáng, sáng, mới xây được vài năm, vẫn còn rất mới.+ Nhà xây 5 tầng kcbt cực chắc chắn, sẵn full nội thất cao cấp, khách mua chỉ việc xách vali vào ở ngay.+ Nhà nằm mặt ngõ lên giao thông đi lại rất thuận tiện, thông nhiều tuyến phố như Nguyễn Khánh Toàn, Nguyễn Văn Huyê...",
"Siêu vị trí Vũ Tông Phan, 10m ra phố, xây mới 6 tầng thang máy lừng lững, mặt tiền bề thế","9,2 tỷ",34 m²,Hà Nội,"Bán nhà đường Vũ Tông Phan 9.2 tỷ ( TL )- 10m ra đường ô tô tránh đỗ đậu, trung tâm sầm uất gần Ngã Tư Sở, Vin cao xà lá, hot..- Chủ xây tâm huyết, nhà mới kính koong 6 tầng thang máy, mặt tiền miên man cực kì bề thế, đẹp nhất, hàng xóm phải ghen tị..- DT 34m² thiết kế thông sàn, full nội thất mới còn thơm mùi gỗ, khách về ở ngay- Khu vực dân trí an ninh tuyệt đối, tiện ích thì không thiếu thứ gì, các trường top đầu..- Sổ đẹp, thanh khoản nhanhLH...",
"Bán nhà Lâm Hạ, khu VIP Long Biên, 7 tầng 50m thang máy, ô tô 7 chỗ vào nhà, full nội thất.","18,5 tỷ",50 m²,Hà Nội,"Lâm Hạ luôn là khu VIP nhất nhì của Long Biên, dân cư tiên tiến, tiện ích bạt ngàn, giao thông kết nối toàn tuyến được huyết mạch như Hồng Tiến, Bồ Đề, Nguyễn Sơn...Nhà đẹp sẵn ở ngay, 7 tầng thang máy full nội thất, bố trí gồm: - Tầng 1: Garẩ - Tầng 2: Phòng khách nhỏ, vui chơi cho trẻ - Tầng 3, 4, 5: Mỗi tầng 1 phòng ngủ rộng khéo kín. - Tầng 6: Phòng khách, bếp. - Tầng 7: Phòng thờ, sân phơi.  Sổ vuông đét, cất két sẵn giao dịch.",
"Bán nhà Tân Hạnh Biên Hòa sổ riêng full thổ cư giá chỉ 2,25 tỷ","2,25 tỷ",63 m²,Đồng Nai,"Cơ hội sở hữu căn nhà cấp 4 giá rẻ khi tìm mua bán nhà Tân Hạnh Biên Hòa, diện tích 63m², đường nhựa 5m thông thoáng, vị trí đắc địa gần khu Tái định cư mới và đường Bùi Hữu Nghĩa. Vị trí đẹp hạ tầng hoàn thiện Tọa lạc tại Phường Tân Hạnh, nay là P. Biên Hòa, khu vực có tốc độ phát triển nhanh và hạ tầng đồng bộ. Kết nối: Cách mặt đường Bùi Hữu Nghĩa chỉ 100m, gần khu Tái định cư Tân Hạnh mới. Hạ tầng: Đường nhựa trước nhà rộng 5m, xe hơi di chuy...",
"Giá tốt để đầu tư - 220m2 ngang 6m nở hậu chỉ 17,x tỷ - chỉ 1 phút ra tới biển Mỹ Khê - chủ gấp bán","17,5 tỷ",220 m²,Đà Nẵng,"Giá quá tốt để đầu tư - 220m² ngang 6m nở hậu chỉ 17,x tỷ - trung tâm kinh tế tài chính Võ Văn Kiệt - chỉ 1 phút ra tới biển Mỹ Khê - sẵn dòng tiền - chủ rất gấp bán.- Kết cấu: Gồm 8 phòng trọ đang cho thuê full, doanh thu 15 triệu/ tháng. - Kiệt nhựa ô tô rộng 5m, cách biển 100m. - Diện tích lớn, hướng nhà mát mẻ. - Chủ bán đất tặng dãy trọ sẵn dòng tiền. - Gần biển, gần sông, cầu Rồng, chợ, trường, phường đa tiện ích. - Giá tốt gần biển Mỹ Khê,...",
"Bán CCMN 1 tỷ/năm chỉ 15 tỷ Lê Quang Đạo 73m2x 7 tầng ,16pkk full đồ mới tinh - 30m ra ô tô",15 tỷ,73 m²,Hà Nội,"Nằm tại Đường Lê Quang Đạo, Phường Từ Liêm, Hà Nội - Quận Nam Từ Liêm, Hà Nội cũ, căn hộ chung cư mini này nổi bật với diện tích 73m², lý tưởng cho những ai đang tìm kiếm không gian sống thoải mái tại Hà Nội. Với thiết kế hiện đại, căn hộ bao gồm 16 phòng ngủ và 16 phòng tắm, phù hợp cho các gia đình lớn hoặc để cho thuê dịch vụ.Các tính năng nổi bật của căn hộ: + Giá bán 15 tỷ VND, rất hợp lý cho diện tích và số lượng phòng. + Nội thất đầy đủ, g...",
"nhỉnh 7 tỷ-nhà dân xây Cầu Diễn 43m sẵn 7 ngủ,20m ra trục chính kinh doanh ô tô dừng đỗ ngày đêm","7,79 tỷ",43 m²,Hà Nội,"Nhà riêng tại Đường Cầu Diễn, Phường Tây Tựu, Hà Nội (địa chỉ cũ: Quận Bắc Từ Liêm, Hà Nội) với diện tích 43 m², giá bán 7,79 tỷ VND, gồm 7PN, 5WC, 5 tầng.  Pháp lý đầy đủ, sổ đỏ.  Mặt tiền 4m, ngõ vào 2.8m, thuận tiện cho ô tô.  Nội thất đầy đủ: điều hòa, giường, tủ lạnh...  Phong thủy tốt, không gian thoáng đãng. Địa điểm xung quanh: - Bệnh viện Đại học Phenikaa. - Trường Trung cấp Nghề Giao thông Công chính Hà Nội. - Trường học các cấp minh kh...",
Bán nhà riêng 64m2 nằm mặt tiền Tạ Quang Bửu,Giá thỏa thuận,64 m²,Hồ Chí Minh,Nhà mặt tiền Tạ Quang Bửu. Diện tích 64m². 1 lầu 3PN 2VS. Giá thỏa thuận. Sổ hồng riêng chính chủ. Ngân hàng hỗ trợ vay 60%. Liên hệ: 0932 244 *** Kim Ngân. (Chính chủ không tiếp cò).,
Nhà giáp Khu Tên lửa 78m2 hẻm xe hơi ngang 5 x15 nở hậu 6m . 3 tấm,"5,93 tỷ",78 m²,Hồ Chí Minh,"Nhà Bình Tân (5.93 tỷ )  Nhà 2/ đường tỉnh lộ 10( thông với Hẻm 111 lê đình cẩn . Diện tích 4,9m *15m (nở hậu 6 m) đúc 2,5 tấm , 3 phòng ngủ , 2 nhà vệ sinh , có thể ngăn thêm nhiều phòng  Hẻm 6, cách đường lớn 5m xe hơi ngủ trong nhà  Giá. 5tỷ 930tr còn thương lượng.",
"Bán nhà đường 2 Lò Lu, Trường Thạnh, Quận 9, diện tích 153m2, giá 7,92 tỷ","7,92 tỷ",153 m²,Hồ Chí Minh,"Mặt tiền đường 2, Lò Lu Trường Thạnh vừa ở vừa có dòng tiền.- Diện tích đất 5.1x 30m. - Nhà cấp 4 và 3 phòng trọ, tiện xây mới. - Đặc biệt: Có sẵn 3 phòng trọ đang cho thuê tạo dòng tiền hàng tháng. - Mặt tiền đường số 2 Ích Thạnh khu dân cư hiện hữu. - Gần UBND phường, tiện làm giấy tờ hành chính. - Kề cận Khu Công Nghệ Cao nhu cầu thuê luôn cao. - Kết nối nhanh ra đường Lò Lu tuyến đường mở rộng, giá trị tăng manh. LH: 0979 405 ***.",
"VILA NƠ TRANG LONG -BINH THẠNH -64 m2- 3 TẦNG -4 pn - GIÁ 7,45 tỷ","7,45 tỷ",64 m²,Hồ Chí Minh,"Siêu Phẩm Villa trung tâm Sài Gòn Lên sóng nhà mới Full nội thất Nơ Trang Long - 3 tầng ngang to DT 64m² .  Diện tích : 5,2m x 12m ( nở hậu 6m)   Kết cấu : 3 tầng , 4 Phòng ngủ full nội thất Có phòng ngủ tầng trệt , 5wc , sân thượng trước sau .  Đặc biệt có phòng Rượu , thư giãn , chill , Phòng Sauna...  Vị trí : Cách mặt tiền Nơ Trang Long chỉ 50m, Cạnh Phường , gần chợ , trường học , giao thông thuận lợi . Khu dân trí cao , an ninh , yên tĩnh G...",
"BACHI ĐẰNG P15 BÌNH THẠNH - 4 TẦNG - 3 pn -3wc - 35 m2 - 5,95 tỷ","5,95 tỷ",35 m²,Hồ Chí Minh,"SIÊU PHẨM  - 4 TẦNG ĐÚC - 35m² - NGAY NGÃ 4 HÀNG SANH - BẠCH ĐẰNG - BÌNH THẠNH  Diện tích: 35m², có sân để xe.,  Kết cấu: 1 Trệt 2 lầu 3 phòng 3wc , sân thượng , phòng thờ, thư giãn có đủ.,Giá 5,95 tỷ bớt lộc vui vẻLIÊN HỆ:Hoàng Hồ",
"Bán nhà rẻ nhất Dương Nội, Hà Đông, Hà Nội.","6,1 tỷ",35 m²,Hà Nội,"Cách đường ô tô tránh vài bước chân gần chợ dân sinh. Gần Aeon mall Hà Đông, Công viên Thiên Văn Học.+ Trước nhà sân rộng, xe để thoải mái, chủ tự xây chắc chắn. Gần phố nhiều tiện ích xung quanh.+ Thiết kế lệch tầng. Tầng 2 phòng, tổng 3 ngủ, 1 khách, 1 bếp, Thờ, sân phơi riêng biệt. Có thế thiết kế lại thành Căn hộ dịch vụ cho thuê dòng tiền ổn định.+ Khu vực dân trí cao, xung quanh yên tĩnh, tiềm năng phát triển. Chủ dân nghệ sĩ vào nhà tòa Lo...",
"Nhà 2 lầu ngay, gần Chợ Bờ Ngựa trường THPT Nguyễn Cửu Phú, 6x20 Giá 810 triệu",810 triệu,120 m²,Hồ Chí Minh,"* Nhà 1 trệt 1 lầu + Sân thượng . Mặt tiền đường Nguyễn Cửu Phú gần chợ Bờ Ngựa: - Nhà ngang 6m dài 20m , có 4 phòng ngủ lớn - Nhà có sân rộng , để được ô tô . Đặt được bàn khi có đám tiệc - Giá 850 triệu ( còn thương lượng ) - Nhà có sổ hồng riêng , mua công chứng - Mua công chứng sang tên được liền ( Ngân Hàng hổ trợ vay 70%) - Đường trước đất 12m , vỉa hè 5m thông thoáng - Nằm ngay khu dân cư hiện hữu , nhà dân ở kín xung quanh - Trong ...",
"Bán nhà riêng tại Lê Văn Phan, 7,4 tỷ, 4x16m, 4 tầng kiên cố, giá siêu hời","7,4 tỷ",64 m²,Hồ Chí Minh,"Căn NR nằm ở Phố Lê Văn Phan, Phường Phú Thọ Hòa, Hồ Chí Minh (địa chỉ cũ: P.Phú Thọ Hòa Quận Tân Phú, Hồ Chí Minh) với diện tích 64m², thiết kế 4PN, 4WC, 4 tầng, hướng cửa chính Đông Nam.  Pháp lý đầy đủ, mặt tiền rộng 4m, ngõ vào rộng 8m, dễ dàng cho xe hơi di chuyển. Nếu cần một không gian sống thoải mái, gần gũi với tự nhiên thì đây chính là lựa chọn tuyệt vời.  Giá chỉ 7,4 tỷ VND, nhanh tay kẻo lỡ nhé! - Khu vực xung quanh   + Bệnh viện quận...",
"Bán gấp nhà 1 lầu, 6x20 giá 810 triệu, nằm ngay chợ Phú Lợi, đang cho thuê 25 triệu/tháng",810 triệu,120 m²,Hồ Chí Minh,"* Kẹt tiền cần bán gấp nhà 1 trệt 1 lầu ngay chợ Phú Lợi:- Nhà ngang 6 dài 20, có 1 lầu, 4 phòng ngủ. - Mặt tiền đường 10m, vỉa hè trước nhà 3m, xung quanh dân đả ở kín. - Nằm ngay Chợ Phú Lợi, thuận tiện vừa ở vừa kinh doanh buôn bán. - Hiện đang cho thuê giá 25 triệu/tháng. - Mua ở có thể nhận nhà ở liền hoặc tiếp tục cho thuê (Nếu không ở).** Giá bán 810 triệu ( còn thương lượng ) - Trả trước 350 triệu nhận nhà ở, phần còn lại trả góp - Nhà có...",
"Hẻm 7m Cửu Long P2 Tân Bình DT 12m x 14m - trệt 2 lầu đẹp Khu an ninh dân trí cao, giá 21 tỷ",21 tỷ,168 m²,Hồ Chí Minh,"Biệt thự mini hẻm 7m Cửu Long khu vip sân bay P2, Tân Bình 3 phút ra sân bay.- DT khủng: 12 x 14m (168m²) ngang hiếm.- Trệt 2 lầu nhà đẹp vào ở ngay.- Hẻm 7m xe hơi tránh, khu an ninh dân trí cao.- Phù hợp: Ở văn phòng CHDV cao cấp.Giá: 21 tỷ TL.Liên hệ 0975 332 *** Quốc.",
"Nhà Cấp 4 với 3 phòng ngủ - TĐC Đất Lành, Nha Trang. Thương lượng 3ty750","3,75 tỷ",64 m²,Khánh Hòa,"Bán nhà cấp 4 đường 13m - TDC đất lành , tây Nha Trang - Dt : 64m² Ngang 4m - Công năng : 3 Phòng ngủ , wc , Phòng khách , Bếp , sân để xe ... - Hướng Đông Bắc  - Đướng nhựa: 13m - Gần ngày các dự án lớn : Sungroup , Ven Sông Tắc .... Nhà còn mới hiện đang có dòng tiền cho thuê 3tr8/tháng  Giá bán : 3 tỷ 750 (thương lượng trực tiếp chủ) Zalo em Châu: 0904 460 ***",
"Hàng đầu tư - 11,3 tỷ - nhà 4 tầng, có thang máy - mặt tiền hẻm 6m, Bình Quới, P. 27, Bình Thạnh","11,3 tỷ",80 m²,Hồ Chí Minh,"Hàng đầu tư, 11,3 tỷ - nhà 4 tầng, có thang máy - Mặt Tiền hẻm 6m, Bình Quới, P. 27, Bình Thạnh. Có sẵn Dòng Tiền 30tr/th. - DT: 80m² (4 x 20)m. - Kết cấu: 1 trệt 3 lầu sàn tum thang BTCT. - Bao gồm 6 phòng căn hộ cao cấp full nội thất từng phòng, 6 wc. - Tiện nghi từng phòng đã được trang bị đầy đủ, phòng cháy chữa cháy, hệ thống camera an ninh, thang máy 4 điểm dừng có buồng thang. - Có HĐ thuê khoán: 30tr/th. Ưu tiên khách mua sang hợp đồng 5 ...",
"Bán nhà riêng, có 3 phòng trọ cho thuê tại Mạc Hiển Tích, phường Long Bình, Quận 9 cũ","3,8 tỷ",80 m²,Hồ Chí Minh,"Chính chủ bán, bán dãy trọ 3 phòng thu nhập ổn định 8tr/tháng Quận 9 cũ. Vị trí: Mạc Hiển Tích, cách Nguyễn Xiển chỉ 100m (đoạn Vành Đai 3 đi ngang). Dãy 3 phòng trọ đang cho thuê, thu nhập đều đặn 8 triệu/tháng. Diện tích: 10x10m, công nhận 80m², vuông vức, đẹp. Thích hợp mua đầu tư giữ tiền, dòng tiền ổn định. Giá tốt cho anh/chị thiện chí.",
"Bán nhà Xã Đàn - Đống Đa, 35m2x6 tầng thang máy, mặt tiền 6m, ô tô đỗ cổng","11,9 tỷ",35 m²,Hà Nội,"Chính chủ bán nhà Xã Đàn, Đống Đa. DT 35m² x 6 tầng mặt tiền 6m. Ô tô đỗ cổng. Trước nhà sân để 40 xe máy, thang máy. 4 ngủ. Nhà không có gì ngoài ánh sáng ban công. 11.9 tỷ. Có TL.Liên hệ: 0904 769 ***.",
"Duy nhất! Bán nhà Đào Tấn , phường Giảng Võ 40m 7,79 tỷ gần phố, ngõ thoáng","7,79 tỷ",40 m²,Hà Nội,"Duy nhất Đào Tấn Ba Đình 40m 7,79 tỷ 0912 322 ***  Tầng 1,2,3 Thông sàn  Tầng 4 : 2 phòng  Tum  5 tầng thông sàn, nhà đẹp ở ngay, sổ đỏ chính chủ,#7tỷ , #badinh , #daotan , #giangvo , #hanoi ,  Duy nhất Đào Tấn , Ba Đình 40m 7,79tỷ 0912 322 *** Bán nhà Đào Tấn , phường Giảng Võ 40m 7,79 tỷ  Liên hệ em Tiến 0912 322 ***",
"Bán CHDV siêu dòng tiền Gò Vấp, 165m2 gồm 5 tầng với 80tr/ tháng giá 12.5 tỷ. 0917 288 ***, nhận KG","12,5 tỷ",165 m²,Hồ Chí Minh,"Chính chủ cần bán căn hộ dịch vụ siêu dòng tiền 80tr / tháng. Với diện tích đất 165m² xây 5 tầng. Gồm 18 căn hộ dịch vụ. Hoàn công chuẩn chỉ, vị trí đẹp chỉ cách Lê Đức Thọ 200m. Chủ thiện chí bán. Liên hệ xem nhà: 0917 288 *** Mr Thương. Nhận ký gửi mua bán.",
