Title,Price,Area,Location,Description,URL
"Bán nhà mới 100% mới xây tuyệt đẹp 5PN, 5WC, tại đường Số 61, Thảo Điền, Q2, giá thực 16.9 tỷ","16,9 tỷ","78,7 m²","·
Hồ Chí Minh","Bán nhà mới xây tuyệt đẹp 5PN, 5WC, tại 22/4 Đường Số 61, Thảo Điền, Q2, giá thực chính chủ 16.9 tỷ.Dt đất: 7.3 x 13.5 (98m²), DT XD: 7.3 x 11, DT sử dung: 240m² (01 trệt và 2 lầu). DT CN 78.7m².Nhà biệt thự mới 100%, nhà 3 tầng, 5 phòng ngủ, 5 toilet. Khu vực trung tâm Thảo Điền.Ngõ vào rộng 4m, mặt tiền 7.4m, Khu vực yên tĩnh, an ninh, bao quanh bởi nhiều trường học quốc tế, nhiều giáo viên người nước ngoài sinh sống.Pháp lý đầy đủ sổ hồng.Hướn...",
"Chính chủ bán nhà ngay trung tâm Quận 9 cũ, hiện tại có 35 phòng thu nhập 150 triệu/ tháng",41 tỷ,369 m²,"·
Hồ Chí Minh","Bán nhà tại 15A đường 8, khu phố 59, Phường Tăng Nhơn Phú, TP. HCM (Quận 9 cũ). Diện tích 369m² kết cấu nhà gồm hầm, 5 tầng, sân thượng có 34 phòng, 1 căn mặt tiền 30m². Mặt tiền 8m nhà, ngõ vào 10m, cách đường lớn 100m rất thuận lợi cho thuê căn hộ và kinh doanh.- Đang có thu nhập 150 triệu/ tháng. - Pháp lý đầy đủ, sổ đỏ. - Nội thất bao gồm điều hòa, tủ đồ,... - Không gian thoáng đãng, phù hợp với đầu tư cho thuê.Gần các tiện ích như: + Gần trư...",
"Chính chủ 30 năm bán nhà 2 tầng hẻm xe hơi sát Phan Xích Long, 46m2, cho thuê được 20 triệu/tháng","6,9 tỷ",46 m²,"·
Hồ Chí Minh","Tổng giảm 1.1 tỷ chỉ 6.9 tỷ thương lượng.Thông tin nhà bán: - Giá bán: Tổng giảm 1.1 tỷ - Chỉ 6.9 tỷ TL. - Vị trí: Lê Tự Tài - Phường Đức Nhuận (P4 cũ) - Phú Nhuận. - Diện tích: 58m² (3.6m x 16m) vuông vức nở hậu, công nhận 46m², DT sử dụng 88m². - Kết cấu: 1 trệt, 1 lầu, 2 phòng ngủ, 2 toilet, sân để xe, phòng khách, bếp, ban công phơi đồ, giếng trời thoáng mát, chỉ cần sơn phết nhẹ vào ở ngay. - Hẻm xe hơi kinh doanh 4m, vài bước ra mặt tiền. -...",
Diện tích đất 40m2 giá 4 tỷ900 bớt ít Lạc Long Quân P10 Tân Bình nhà cũ có thể cải tạo và xây,"4,9 tỷ",40 m²,"·
Hồ Chí Minh","Mình chính chủ cần bán căn nhà.Bán nhà Lạc Long Quân P10 Tân Bình. Giá 4 tỷ900(TL).Diện tích: 6x7.5m. Sổ công nhận 40m². Kết cấu: 1 trệt. 1 lầu. 3PN. 2WC. Vị trí: Hẻm trước nhà 4m.. Thông tất cả các hướng.. Hẻm yên tĩnh. Gần chợ Tân Bình, Bàu Cát. Hướng Đông. Giá 4 tỷ900 thương lượng. LH Vân. Zalo. 0937 640 ***.",
Nhà 3 tầng 888/26 Lạc Long Quân P8 Tân Bình giá 4 tỷ 350 gần chợ Tân Bình giáp Quận 10 và 11,"4,35 tỷ","28,6 m²","·
Hồ Chí Minh","Mình chính chủ cần bán căn nhà. Hẻm xe hơi đậu cửa cách 30m ra mặt tiền Lạc Long Quân.Địa chỉ 888/26 Lạc Long Quân P8 Tân Bình. Giá 4 tỷ350(TL).Diện tích: 2.5x12m. Đất thực tế 30m². Sổ công nhận 28.6m².Kết cấu: 1 trệt 2lầu 2PN 2WC. Vị trí Hẻm xe hơi đậu cửa cách 30m ra mặt tiền Lạc Long Quân gần chợ Tân Bình gần chợ Ông Địa gần Bàu Cát giáp quận 10 và 11 thông tất cả các hướng. Buôn bán các như như cơm, nail, tóc, tạp hóa.. v.. v. Hướng tây.Giá 4...",
"Chính chủ bán nhà HXH 6m Lê Trọng Tấn 4,5x14( 63m2), 1T1L. Giá TL: 4tỷ680, sổ riêng bao sang tên","4,68 tỷ",63 m²,"·
Hồ Chí Minh","NHÀ MỚI XÂY CHÍNH CHỦ CẦN BÁN GIÁ: 4 TỶ 680( thương lượng) VỊ TRÍ: 115/ Lê Trọng Tấn, Tân Sơn Nhì, Tân Phú, HCMDiện tích lớn: 4,5x14 (63m²) Kết cấu nhà 1 trệt 1 lầu, 1 sân thượng, nhà mới xây kiên cố rất sạch và thoáng, 3 phòng ngủ (có phòng ngủ dưới trệt)  Mặt tiền trước nhà 6m, xe tải né nhau còn được.  Sổ hồng riêng, không tranh chấp  Vay NH ok Liên hệ chính chủ: 0937 502 *** (Thiên Kim)",
"Nhà đẹp Trần Quý Kiên, Cầu Giấy, DT 38m2, 6 tầng, sổ đỏ, ngõ rộng 8m, full nội thất, nhiều tiện ích",Giá thỏa thuận,38 m²,"·
Hà Nội","Chính chủ chuyển công tác nên cần bán lại căn nhà riêng phố Trần Quý Kiên, Cầu Giấy, Hà Nội. Vị trí đẹp, ngõ rộng, chỉ việc xách vali vào ở.- Diện tích: 38m², mặt tiền 3.15m, 6 tầng, ngõ rộng 8m, ô tô quay đầu. Thiết kế gồm 4PN 3WC, công năng đầy đủ. Full nội thất: Điều hòa, giường, tủ lạnh vào ở ngay.- Tiện ích. Gần ĐH Quốc Gia, Sư Phạm, Thương Mại. Gần chợ, siêu thị, công viên. Khu dân trí cao, an ninh tốt. Phù hợp ở gia đình hoặc cho thuê.Giá ...",
"GIẢM SỐC CÒN 7.9 TỶ  NHÀ ĐƯỜNG QUANG TRUNG, GÒ VẤP","7,9 tỷ",78 m²,"·
Hồ Chí Minh","Nhà đẹp  diện tích hiếm  hẻm xe tải  vị trí trung tâm  Thông tin chi tiết:  Diện tích: 78m² (đất nở hậu, phong thủy tốt)  Kết cấu: 1 trệt 3 lầu (4 tấm kiên cố)  Công năng:-	4 phòng ngủ rộng ( có 1 phòng VIP rộng rãi) -	5 toilet hiện đại -	1 phòng khách lớn -	Bếp và phòng ăn rộng, thoáng -	Giếng trời đón gió và nắng phía sau  Hẻm rộng: 8m, xe tải vào tận nhà  Hướng: Tây Nam  Nhà xây chắc chắn, thiết kế hiện đại, dọn vào ở ngay. Tiện ích xung quanh...",
"Bán nhà riêng tại 245 Đường 28/3, Hội An, 8 tỷ, 220 m2",8 tỷ,220 m²,"·
Đà Nẵng (Quảng Nam cũ)","Nhà riêng tọa lạc tại 245 Đường 28/3, Phường Thanh Hà, Hội An, Quảng Nam, với diện tích 220 m², giá bán 8 tỷ VND. Đây là một cơ hội tuyệt vời để sở hữu một căn nhà không nội thất, pháp lý đầy đủ. Với vị trí đắc địa và không gian rộng rãi, căn nhà này phù hợp cho những ai đang tìm kiếm một mặt bằng kinh doanh tại Hội An. Hãy liên hệ để được tư vấn miễn phí qua số 0919 850 ***. Đừng bỏ lỡ cơ hội này!",
"Cần bán gấp - Rẻ hơn thị trường 300 triệu nhà 38m2 5 tầng Thạch Bàn - Long Biên chỉ 6,69 tỷ","6,69 tỷ",38 m²,"·
Hà Nội","Vị trí vàng: Ngõ 68 Nguyễn Văn Linh, Long Biên. Nhà cách mặt phố đúng 20m (cực nông, đi lại thuận tiện). Sát cạnh công viên 30ha đang xây dựng & TTTM Aeon Mall Long Biên. Thông số cực đẹp: Diện tích: 38m² x 5 tầng. Thiết kế hiện đại, ban công ngập tràn nắng gió. Tầng 1: Phòng khách, bếp, vệ sinh & sân để xe riêng biệt (rất sạch sẽ). Tầng 2, 3, 4: Mỗi tầng 1 phòng ngủ khép kín rộng rãi + ban công thoáng. Tầng 5: Phòng thờ/phòng nhỏ + sân vườn chil...",
"Bán nhà đường Lý Chính Thắng Quận 3, Giá 3Tỷ790, 63m2, sổ chính chủ, đang cho thuê 20tr/tháng","3,79 tỷ",63 m²,"·
Hồ Chí Minh","Chuyển đơn vị công tác, tôi cần bán căn nhà đường Lý Chính Thắng, phường 8, Quận 3 (nay là phường Xuân Hoà) - Nhà đang cho thuê 1 tháng 20 triệu - Diện tích 63m². - Kết cấu 1 trệt 2 lầu và sân thượng, bên trong có 4 phòng ngủ, 4 toilet. - Nhà có sổ hồng, chính tôi đứng tên. - Hẻm rộng, thông thoáng, có nhiều camera an ninh, cao ráo không bị ngập, hàng xóm tri thức, thân thiện. - Vị trí rất đẹp trung tâm của Sài Gòn thông ra Nam Kỳ Khởi Nghĩa, Hai...",
"Bán nhà 2 mặt tiền Đỗ Nhuận, Sơn Kỳ, Tân Phú 44.6m² gần Celadon City đang kinh doanh tốt giá 11.5tỷ","11,5 tỷ","44,6 m²","·
Hồ Chí Minh","Cần bán gấp nhà riêng chính chủ tại đường Đỗ Nhuận, phường Sơn Kỳ, quận Tân Phú. Nhà sở hữu 2 mặt tiền hiếm, vị trí kinh doanh sầm uất, ở gần khu đô thị Celadon City, đang khai thác quán ăn cà phê với thu nhập ổn định. Phù hợp mua ở kết hợp đầu tư sinh lời lâu dài.Thông tin chi tiết căn nhà. Địa chỉ: 15 Đỗ Nhuận, Sơn Kỳ, Tân Phú, TP. HCM. Diện tích đất: 44.6m². Diện tích sử dụng: 175.2m². Kết cấu: Nhà xây kiên cố, thiết kế tối ưu công năng. Hiện ...",
"Chính chủ bán gấp 4.3M X 16M đúc 2tấm , khu đồng bộ hẻm xe hơi thông thoáng giá chỉ 5,9T còn bớt","5,9 tỷ",65 m²,"·
Hồ Chí Minh","Ngôi nhà riêng tại 493, Đường Lê Đức Thọ, Phường An Hội Đông, Hồ Chí Minh, trước đây Quận Gò Vấp, Hồ Chí Minh cực chất với 4PN, 2WC, chiều ngang mặt tiền 4.3m. Nhà 3 tầng, hướng cửa chính và ban công Đông Bắc, ngõ vào rộng 4m, thuận tiện cho việc di chuyển. Pháp lý đầy đủ, yên tâm khi giao dịch.Giá: 5,9 tỷ VND- Phù hợp cho gia đình đông thành viên hoặc đầu tư cho thuê - Mặt tiền rộng, dễ dàng kinh doanh nếu cần - Ngõ vào rộng, ô tô ra vào thoải m...",
"Toà CHDV Giảng Võ, 70m2*7tầng, MT 5m, 17 phòng, cách Vinhome 100m, đủ GPXD/PCCC, dòng tiền 100tr/th","20,5 tỷ",70 m²,"·
Hà Nội","Toà CHDV Giảng Võ - Trung tâm Ba Đình - Cách Vinhome Giảng Võ 100m - 7 tầng thang máy - 17 phòng khép kín - Dòng tiền 100tr/th.- Diện tích 70/75m², xây 7 tầng thang máy, tổng 17 phòng khép kín, full nội thất. - Vị trí gần Vinhome Giảng Võ, hồ Ngọc Khánh, thông Đê La Thành, Ngọc Khánh, khách thuê chất lượng cao. - Giao thông cực tiện: Vài bước ra mặt phố. - Dòng tiền đang khai thác ổn định: ~100tr/tháng (~1.2 tỷ/năm).  - Thiết kế: + Tầng 1: Để xe ...",
"Tôi chủ nhà bán nhà 6 phòng ngủ, 40m2 5T tại Phú Đô, ngõ ô tô tránh, trước nhà 3m chỉ 8 tỷ",8 tỷ,40 m²,"·
Hà Nội","Tôi chính chủ trên sổ đỏ bán nhà Lê Quang Đạo (Phú Đô), Nam Từ Liêm. Nhà 35/40m² x 5 Tầng.6 phòng 3 vệ sinh - full nội thất - ô chờ thang máy sẵn có. (Có thể làm 6 phòng dòng tiền cho thuê hoặc sửa làm 8p cho thuê. Nhà 5 tầng: + Tầng 1: Phòng khách và bếp, WC. + Tầng 2,3: Mỗi tầng 2 ngủ, WC. + Tầng 4: 1 phòng to + 1 phòng nhỏ và sân phơi. + Tầng 5: Tum + sân trồng cây...- Phía sau có khe thoáng. Phòng nào đều gió thoáng tự nhiên, ánh sáng ngập tr...",
"BÁN NHÀ NGUYỄN THIỆN THUẬT (4,23 x 17m) + HẦM 7 TẦNG THANG MÁY PCCC ĐẦY ĐỦ + 13 CHDV CAO CẤP","16,85 tỷ",76 m²,"·
Hồ Chí Minh","Bán Nhà Bình Thạnh - Nguyễn Thiện Thuật & Bùi Đình Túy Phường 24 Quận Bình Thạnh ( Nay thuộc Phường Bình Thạnh ) ,  Cách mặt tiền Nguyễn Thiệt Thuật 50m chỉ vài bước chân.- Diện tích: 4,23 x 17m Nở Hậu Tài Lộc  . Tổng diện tích : 368,9m². - Kết cấu: HẦM 7 TẦNG ( TRỆT TRỆT LỬNG 4 LẦU MCCT ) + THANG MÁY . Hiện có 13 CHDV thiết kế: phòng ngủ riêng + gác lửng + bếp. - Xây mới xây tâm huyết, hoàn công 11/2025. - Trang bị đầy đủ PCCC, an ninh, lối thoá...",
"Bán căn hộ dịch vụ 244m2, 118 tỷ, đường số 1, Thảo Điền, Q2, view đẹp, giá ưu đãi",118 tỷ,244 m²,"·
Hồ Chí Minh","Căn hộ dịch vụ tại Đường số 1, Phường Thảo Điền, Quận 2, Hồ Chí Minh là một lựa chọn lý tưởng cho những ai tìm kiếm không gian sống thoải mái và tiện nghi. Với 12 phòng ngủ và 16 toilet, căn hộ này đáp ứng tốt nhu cầu sinh hoạt cho gia đình lớn hoặc nhóm bạn. Căn hộ nằm ngay gần đường ven bờ sông Sài Gòn thơ mộng và mát mẻ.+ Diện tích rộng rãi 244m², không gian sống thoáng đãng. Chiều ngang rộng đến 20m. + Nội thất đầy đủ, bao gồm điều hòa, giườn...",
9 tỷ nhỉnh có ngay nhà 65m2 x 5 tầng 5 phòng ngủ mới tinh ngõ oto - Đức Giang - rẻ nhất Long Biên,"9,5 tỷ",65 m²,"·
Hà Nội","9.x tỷ nhà 65m² 5 tầng 6 ngủ ô tô đỗ cổng rẻ nhất Long Biên.Gần chung cư Bình Minh Garden tiện ích bạt ngàn.Nhà mới tinh, đang hoàn thiện thiết kế hiện đại:* DT: 65m² x 5 tầng. * 6 phòng ngủ rộng thoáng. * Ngõ ô tô đỗ cửa, vài bước ra đường ô tô tránh kinh doanh.Công năng:* T1: Khách + bếp + để xe. * T2 - 3 - 4: Mỗi tầng 2 phòng ngủ + VS. * T5: Phòng thờ + sân phơi.Sổ đỏ chính chủ nở hậu pháp lý chuẩn. Giá chỉ: 9.x tỷ (rẻ nhất khu vực).LH: Mr Vin...",
9.x tỷ nhà 65m2 5 tầng 6 ngủ ô tô đỗ cổng rẻ nhất Long Biên,"9,5 tỷ",65 m²,"·
Hà Nội","9.x tỷ nhà 65m² 5 tầng 6 ngủ ô tô đỗ cổng rẻ nhất Long Biên.Gần phố Nam Đuống cách mặt phố chỉ ~200m. Gần chung cư An Quý tiện ích bạt ngàn.Nhà mới tinh, đang hoàn thiện thiết kế hiện đại:* DT: 65m² x 5 tầng. * 6 phòng ngủ rộng thoáng. * Ngõ ô tô đỗ cửa, vài bước ra đường ô tô tránh kinh doanh.Công năng:* T1: Khách + bếp + để xe. * T2 - 3 - 4: Mỗi tầng 2 phòng ngủ + VS. * T5: Phòng thờ + sân phơi.Sổ đỏ chính chủ nở hậu pháp lý chuẩn. Giá chỉ: 9.x...",
"Nhà thô đẹp xây dựng chỉnh chu, bề ngang rộng đẹp, đường thông Vành Đai 2, kề trường học, Sungroup","10,5 tỷ","127,5 m²","·
Khánh Hòa","- Bán nhà thô đường T12 KĐT An Bình Tân lô sạch. - DT: 127.5 m²(ngang 5.67m) hướng TN. - Kết cấu: 1 trệt 3 tầng, tầng trệt p khách + bếp, tầng 2 3 gồm 2PN trước sau, tầng 4 ban công và sân phơi, có chừa sẵn ô thang máy. - Vị trí thoáng đẹp, đường thông vành đai, nhà kiên cố, xây dựng chỉnh chu, tỉ mỉ, view KĐT Sungroup, dự án đường 28 thông Phúc Sơn(dự án sân bay cũ) thuận lợi di chuyển ra biển. - Giá bán: 10.5 tỷ(pháp lý HĐMB). - LH: 0914 201 ***...",
"BÁN NHÀ MỚI HẺM XE HƠI 8M, DIỆN TÍCH SỬ DỤNG 75 m2, TẠI QUẬN 10, TRUNG TÂM THÀNH PHỐ","4,45 tỷ",25 m²,"·
Hồ Chí Minh","- BÁN NHÀ RIÊNG TẠI QUẬN 10, TRUNG TÂM THÀNH PHỐ, GẦN SIÊU THỊ BIG C MIỀN ĐÔNG, TRƯỜNG ĐH NGOẠI NGỮ TIN HỌC, ĐH BÁCH KHOA, ĐH Y KHOA PHẠM NGỌC THẠCH, GẦN BV 115, BV CHỢ RẪY, BV ĐH Y DƯỢC TPHCM. RẤT THUẬN TIỆN ĐI LẠI GIỮA CÁC QUẬN 1, 3, 5, TÂN BÌNH. GẦN SÂN BAY TÂN SÂN NHẤT VÀ GA SÀI GÒN.  - DIỆN TÍCH 25 m² (DIỆN TÍCH SỬ DỤNG 75 m²).  - NỘI THẤT MỚI 100%, ĐẦY ĐỦ: BẾP TỪ, TỦ BẾP, TỦ QUẦN ÁO CÁC PHÒNG, QUẠT.",
"7,8tỷ nhà 4tầng đường 9m thông view sông liền kề Vạn Phúc Hiệp bình Phước Thủ Đức sát Quốc Lộ 13","7,8 tỷ",60 m²,"·
Hồ Chí Minh","7,8 tỷ. Bán nhà phố mới 100% 44 căn đồng bộ an ninh sát cổng Vạn Phúc view sông Hiệp Bình Phước Thủ Đức. Tương lai đón đầu mở rộng trục Quốc Lộ 13 đã bán 35/44 căn.- Đường thông ô bàn cờ rộng 9 m. Cách sông SG 100 m. Cách Quốc Lộ 13 tầm 100 m. - DT: 56m², 60m². - Đầu tư sinh lời, phù hợp ở, làm văn phòng công ty, đầu tư cho thuê(28 - 30tr/ tháng) hoặc khai thác CHDV.- TK: 4 tầng. Phù hợp văn phòng công ty tích hợp ở.- Trệt, lửng, 4 phòng ngủ 4 WC...",
"Giảm mạnh, giá thỏa thuận. Bán nhà 57m2 Phan Văn Trị, P14, Bình Thạnh. Xây 4 tầng, hẻm 5m. SHR",Giá thỏa thuận,57 m²,"·
Hồ Chí Minh","Vị trí: Đường Phan Văn Trị, Phường 14, Bình Thạnh. Gần chợ phan văn trị, Phạm Văn Đồng. Tiện kinh doanh hoặc cho thuê. Hẻm xe hơi lớn, thông nhiều hướng, di chuyển trung tâm dễ dàng.Diện tích: 57m². Kết cấu: 1 trệt, lửng, 2 lầu, sân thượng. Gồm 3 phòng ngủ 4 wc. Gía: 2 tỷ450(có hỗ trợ vay ngân hàng). Sổ sẵn, công chứng trong ngày. Đang cho thuê 15tr/tháng liên hệ xem nhà trực tiếp. Liên hệ: 0767 208 *** Cẩm Vân để hỗ trợ xem nhà.",
"Bán nhà đẹp Ba Đình, DT 40m2, 6 tầng thang máy, ngõ thông, sát phố, dọn ở ngay, chỉ 12.x tỷ","12,95 tỷ",40 m²,"·
Hà Nội","Bán nhà riêng Sơn Tây, quận Ba Đình, nhà mới, thiết kế hiện đại, vào ở ngay.* Diện tích: 40m². * Mặt tiền: 4.1m. * Kết cấu: 6 tầng, có thang máy. * Thiết kế: * Tầng 1: Phòng khách + WC. * Tầng 2,3,4: Mỗi tầng 1 phòng ngủ khép kín. * Tầng 5: Bếp + phòng ăn. * Tầng 6: Phòng thờ + sân phơi. * Nhà xây mới, nội thất đầy đủ. * Ngõ thông, đi lại thuận tiện. * Khu dân trí cao, an ninh tốt. * Pháp lý: Sổ đỏ chính chủLiên hệ em Thiên Tùng 0325 433 ***. Hỗ tr...",
Tôi tên Thông Bán Nhà Đường Lê Quang Định Phường1 Gò Vấp DT 61M2 TÔI BÁN 3TỶ680,"3,68 tỷ",61 m²,"·
Hồ Chí Minh","Tôi tên Thông Bán Nhà Đường Lê Quang Định Phường1 Gò Vấp Giá 3tỷ680,  (có bớt cho cô chú thiện chí mua) Liên Hệ; 0776 723 *** gặp đi đến xem nhà trực tiếp nhé Đang cho thuê 16tr/tháng Diện tích: 5.5x11=61m² Sổ hồng tôi đứng tên sang tên liền Kết cấu 1trệt 2lầu Hẻm lớn xe hơi đi thoải mái, an ninh tốt Nằm gần Trường Cao Đẳng Bách Khoa Sài Gòn, gần UBND Phường1, cách Phạm Văn Đồng chĩ 1p đi xe, gần Trường Đại Học Công Nghiệp TP.HCM chỉ 5p đi chuyển  ...",
Nhà xây mới chính chủ - 0973 609 ***,"6,2 tỷ","63,4 m²","·
Hồ Chí Minh","Luckyhouse 9 nhà mới 3 lầu, giá tốt nhất khu vực!Địa chỉ: Hẻm 60, Đường Hoàng Hữu Nam, Long, phường Long Bình TPHCM. Hướng: Chính Nam đón tài lộc, may mắn tràn đầy.Diện tích: 63,6m² (ngang 4m x dài 15,9m). Kết cấu: 3 lầu rộng rãi, thiết kế hiện đại.Tiện ích vượt trội: Phòng khách - bếp sang trọng, rộng rãi. Phòng ngủ dưới trệt. 4 phòng ngủ: Thoáng mát, đón nắng tự nhiên. 3 WC + sân giặt phơi: Tiện nghi, thoải mái. Phòng thờ riêng: Không gian tran...",
Bán nhà gần chợ Thiếc giá 3 tỷ950. Địa chỉ đường 3/2 P6 Q11. Nhà 3 tầng sửa chữa được 4 PN 3WC,"3,95 tỷ",27 m²,"·
Hồ Chí Minh",Mình chính chủ cần bán nhà.Giảm 300tr. Trước bán 4 tỷ250 giờ giảm còn 3tỷ950.Bán nhà 3 tầng 2 căn liền kề. Hẻm đẹp 2 mặt hẻm trước và sau. Gần chợ Thiếc 1133/43 đường 3/2 P6 quận 11.2.7*10m. Diện tích sử dụng 54m². Kết cấu 1 trệt 2 lầu. Sửa được 4 PN 3WC giá 3tỷ950 (TL).Vị trí hẻm trước nhà 3.5m. 2 mặt hẻm trước và sau rất thoáng mát. Gần chợ Thiếc. Gần BV Chợ Rẫy. Gần Lê Đại Hành. Hướng Đông Nam. Giá 3 tỷ 95 (TL).LH Vân. Zalo 0937 640 ***.,
Chính chủ gửi bán nhà Phạm Văn Hai - Vài bước ra xe hơi - 3 tầng 36m2 đầy đủ nội thất - Chỉ 5tỷ629,"5,63 tỷ",36 m²,"·
Hồ Chí Minh","Chính chủ gửi bán nhà Phạm Văn Hai, phường 5, Tân Bình - Vài bước ra hẻm xe hơi, thông Cách Mạng Tháng Tám, gần Công viên Lê Thị Riêng. * Kết cấu 3 tầng đẹp, đúc chắc chắn, 36m², tặng lại đầy đủ nội thất xịn cho khách hữu duyên. * Chỉ 5.629 tỷ thương lượng chính chủ. * Phân khúc 5 tỷ nhỉnh sẵn kết cấu đẹp như này không có căn thứ hai, anh chị tìm nhà phân khúc 5 - 6 tỷ thì nhanh chân xem liền mới kịp ạ!Liên hệ em Liên 0904 696 *** để xem nhà và g...",
"Sở hữu ngay tuyệt phẩm 58.7m2 ôtô đỗ thoải mái nội thất cao cấp tuyến 2 Võ Nguyên Giáp, HP, giá tốt","8,1 tỷ","58,7 m²","·
Hải Phòng","Tuyệt phẩm nhà phố tuyến 2 Võ Nguyên Giáp, Lê Chân, Hải Phòng - Aeon Mall - 5 tầng thang máy - full nội thất cao cấp.Vị trí siêu đẹp: Tuyến 2 Võ Nguyên Giáp ngay gần AEON Mall, Vinmec, Vin Marina trung tâm phát triển sầm uất. Đường rộng 8m, vỉa hè 2 bên 3 ô tô đỗ song song thoải mái. - Diện tích: 58.7m² x 5 tầng (có đua văng tối ưu không gian). - Thiết kế hiện đại, tối ưu công năng: - 4 phòng ngủ rộng rãi. - 1 phòng master sang trọng. - Phòng khá...",
Bán Nhà Đường Nguyễn Văn Quá Q12 Gần Nhà Hàng Đông Phương 4 x 15 Nhà Cấp 4 có lửng Hẻm 3.5m,"4,2 tỷ",56 m²,"·
Hồ Chí Minh",Cần Bán Nhà Đường Nguyễn văn Quá Q12  Gần Nhà Hàng Tiệc Cưới Đông Phương  Nhà 1 Trục 1 Xẹc  Hẻm 3m Sạch Sẽ Sát Mặt Tiền  Gần Trường Gần Chợ Cây Sộp  Diện Tích 4 x 15 Nhà trệt Lửng cấp 4 cũ Tiện xây mới Hoặc Cho thuê Giá chỉ 4 tỷ2 Bớt Lộc  LH: 0909 677 *** Thanh Hiền,
Nhà đúc 2 tầng - hẻm xe hơi thông - đường Nguyễn Văn Quá Q12 Diện Tích khủng 4x124m - sổ hồng riêng,"6,5 tỷ",96 m²,"·
Hồ Chí Minh","DIỆN TÍCH KHỦNG  - BÁN Nhà chính Chủ Đường Nguyễn Văn Quá Q12  - Gần Nhà Hàng Tiệc Cưới Đông Phương - Diện Tích : 4 x 24 Đúc 2 Tấm ( Trệt Lầu Mái đúc )  - Hẻm Thông Bàn Cờ Xe Tải  - Vị trí: nằm khu dân cư hiện hữu gần chợ,nhà thờ. Giá Hơn 6 tỷ x...  LH: 0909 677 *** THANH HIỀN",
"Bán nhà 4 tầng, 4,5m x 24,7m, 78 Hoàng Văn Thụ, Đức Nhuận, HCM",24 tỷ,"83,32 m²","·
Hồ Chí Minh","- Nhà xây dựng để ở 2018, kết cấu 4 tầng rộng thoáng, mặt tiền ngang 4,5m, dài 24,7m, diện tích đất 83,3m², diện tích sử dụng 281,3m². Khu trung tâm Phú Nhuận, vị trí đắc địa, trục đường lớn giao thông chính, thương mại sầm uất, phù hợp Spa, VP làn việc giao dịch, Showroom, dịch vụ bảo hành, đào tạo - Nội thất gồm 7 phòng lớn nhỏ đã Format ốp vách kính sơn trang trí hiện đại, sàn gạch men, gỗ, la phong LED, đèn chùm, đèn thông tầng, chiếu điểm sa...",
Tân Phú giáp Tân Bình nhà Hoàng Xuân Nhị. Phú Trung Tân Phú ngay ngã tư Âu Cơ Lạc L Quân giá 4.6 tỷ,"4,6 tỷ",36 m²,"·
Hồ Chí Minh","Mình chính chủ cần bán căn nhà.Cách mặt tiền Lạc Long Quân 30m, 10/4 Hoàng Xuân Nhị Phường Phú Trung Tân Phú. Giá 4 tỷ 600 bớt lộc.Diện tích: 36m² 1 trệt, 1 lầu 2PN 2WC. Vị trí: Hẻm cách 30m ra mặt tiền Lạc Long Quân. Gần chợ Trần Văn Quang. Gần ngã tư Âu Cơ. Lạc Long Quân. Hướng Tây Nam.Giá 4 tỷ 600 (bớt lộc). LH Vân. Zalo. 0937 640 ***.",
Giảm sốc chỉ còn hơn 7 tỷ HXH - ngay Vạn Phúc 300m - 130m2 - 3 PN - sổ vuông - không quy hoạch,"7,5 tỷ",130 m²,"·
Hồ Chí Minh","Chính chủ gửi nhà hẻm 520 Quốc lộ 13 - hàng hiếm hẻm xe hơi Hiệp Bình Phước, Thủ Đức - ngay Vạn Phúc - 130m - nhà cấp 4 - có 3 PN - nhà còn mới chỉ hơn 7. X tỷ.+ Vị trí: Cạnh bên Quốc lộ 13 - Khu đô thị Vạn Phúc. + Thông tin: Minh bạch - uy tín - tận tâm. + Đơn giá chỉ 5x. Tr/m² - Còn TL mạnh ạ. Call/Zalo (Chính chủ): 0901 333 *** Lê Nguyên - Em cám ơn. Nhận ký gửi mua bán nhà Thủ Đức.",
"Bán Nhà Riêng tại 270/88/8 Phan Đình Phùng, 5,9 tỷ, 38m2 giá cực chất","5,9 tỷ",38 m²,"·
Hồ Chí Minh","Nhanh tay sở hữu ngôi nhà riêng lý tưởng tại 270/88/8, Đường Phan Đình Phùng, Phường Cầu Kiệu, Hồ Chí Minh, trước đây Quận Phú Nhuận, Hồ Chí Minh với những đặc điểm nổi bật sau đây:+ Diện tích 38m², phù hợp cho gia đình nhỏ. + 2PN, 2WC, thiết kế hiện đại, tiện nghi đầy đủ. + Phong thủy tốt, mang lại tài lộc và sức khỏe cho gia đình. + Giá bán hấp dẫn chỉ 5,9 tỷ VND.Gần các tiện ích như: + Gần trường học Miraiku Little Hands Nursery, Trường Mầm No...",
Chính chủ cần bán CCMN 9tầng 48p cho thuê - dòng tiền 280tr/tháng - 150m² 56tỷ - trung tâm Mỹ Đình,56 tỷ,"149,8 m²","·
Hà Nội","Bán tòa chung cư mini dòng tiền cao Mỹ Đình, Từ Liêm. Địa chỉ: Số 36 ngõ 33 Phú Mỹ, Từ Liêm, Hà Nội. Diện tích: 149.8m². Mặt tiền: 15m siêu rộng, cực hiếm. Quy mô: 9 tầng 48 phòng (1N1K & Studio). Ô tô vào tận nhà lợi thế lớn, tăng giá trị khai thác & thanh khoản. Dòng tiền hiện tại: ~280 triệu/tháng (full phòng, vận hành ổn định). Điểm mạnh đầu tư: - Mặt tiền 15m cực hiếm, dễ khai thác, tăng giá trị tài sản. - Tòa nhà quy mô lớn tối ưu công năng...",
