Title,Price,Area,Location,Description,URL
"CHÍNHCHỦ GỬI N PHÂN LÔ 2 MẶT NGÕ Ô TÔ, KINH DOANH, 5 TẦNG THANG MÁY, CHỈ CÁCH MỘT NHÀ LÀ RA MẶT PHỐ","22,8 tỷ",47 m²,Hà Nội,"Chính chủ gửi bán! Bán nhà riêng tại Đường Cầu Giấy, Đường Cầu Giấy, Phường Cầu Giấy, Hà Nội (cũ: Quận Cầu Giấy, Hà Nội) với mức giá 22,8 tỷ VND.  - Diện tích 47m², nhà 5 tầng, 4PN, 6WC, nội thất cơ bản.  - Mặt tiền 4.6m, ngõ vào rộng 5m, thuận tiện cho ô tô vào.  - Pháp lý đầy đủ, đảm bảo an toàn cho giao dịch.  - Phong thủy tốt, mang lại sự thịnh vượng cho gia chủ. Tiện ích xung quanh:  - Cách công viên Nghĩa Đô, Cầu Giấy, Yên Hòa không xa, lý ...",
Cần bán nhà MT hẻm xe hơi CMT8 P15 Q10,20 tỷ,"80,4 m²",Hồ Chí Minh,"Cần bán gấp căn nhà MT hẻm xe hơi CMT8 P15 Q10. Cách đường CMT8 20m.. Nhà 5 tầng gồm 7 căn hộ dịch vụ , nội thất cao cấp, có thang máy.   Mỗi tháng vừa ở vừa có thu nhập từ 50-70tr.  Gần công viên Lê Thị Riêng, chợ Hoà Hưng, Mọi chi tiết liên hệ 0908 343 *** A Châu",
"Bán nhà phố Nguyễn Lương Bằng, 30m ra Phố, ngõ ba gác, thông, KD cho thuê, thang máy, giá: 11 tỷ",11 tỷ,37 m²,Hà Nội,"- Bán nhà phố Nguyễn Lương Bằng, 30m ra phố, ngõ ba gác, thông, kd cho thuê, thang máy, giá: 11 tỷ TL.- DT 37m² x 5 tầng thang máy, MT 5m.- Vị trí: TT lõi Đống Đa, 30m ra Phố, 80 m ra Hồ Đắc Di, xung quanh toàn công ty, ngân hàng, quán ăn, toà CC cao cấp.- Nhà đẹp mới king koong, lô góc thoáng sáng, quanh năm ánh sáng tran hoà, nội thất cao cấp nhập khẩu Quốc Tế, 5 tầng thang máy, thiết kế thông sàn.- Sổ đỏ chính chủ.- LH: Em Nam SDT 0862 607 *** đ...",
"Chính chủ bán nhà đẹp Bình Thạnh Phan Văn Trị, 3PN, hẻm thông Phạm Văn Đồng, giá 5,4 tỷ TL","5,4 tỷ","48,75 m²",Hồ Chí Minh,"Nhà đẹp Bình Thạnh ở ngay hoặc có thể cho thuê 11tr/tháng. Chính chủ cần bán căn nhà vị trí đẹp đường Phan Văn Trị, P. 11, Bình Thạnh khu dân cư hiện hữu, an ninh, tiện ích đầy đủ. Diện tích: 3,75m x 13m. Kết cấu: 1 trệt 1 lầu - 3 phòng ngủ rộng rãi, 1 bếp lớn thoáng mát, 2 phòng tắm. Nhà còn mới, sạch đẹp dọn vào ở ngay. Khai thác cho thuê tốt ~11 triệu/tháng. Phù hợp mua giữ tiền. Đầu tư dòng tiền ổn định. Gia đình nhỏ an cư lâu dài. Vị trí cực...",
"3,5 ty. Nhà 1 trệt đã đổ tấm, trước nhà khuôn viên rộng rãi, khu vực hàng xóm toàn cán bộ công an.",Giá thỏa thuận,110 m²,Đồng Nai,"Nhà 1 trệt đã đổ tấm Ngay cạnh Công an P.Long Khánh S=110m²(5x22) Trước nhà khuôn viên rộng rãi, thoáng mát. Có chỗ để xe oto, kv an ninh tuyệt đối. Hàng xóm toàn cán bộ công chức. Gia đình đi nước ngoài cần bán!",
"Tin chuẩn! Lô góc Phan Kế Bính, ngõ thông, thang máy, 50m ra mặt phố, dân xây, mới đẹp, 42m2*5T","8,9 tỷ",42 m²,Hà Nội,"- Bán nhà riêng tại phố Phan Kế Bính, phường Ba Đình - Ngọc Hà, Hà Nội. Diện tích 42m², 5 tầng thang máy, giá chỉ 8.9 tỷ (Có thương lượng). - Căn nhà với vị trí lô góc, 2 thoáng, ánh sáng ngập tràn. Nhà ngõ thông kinh doanh, từ nhà ra phố lớn chỉ khoảng 50m. Khách mua về ở ngay hoặc cho thuê kinh doanh cực tiện. - Khu vực với vị trí vàng, trung tâm Ba Đinh. Nhà kết nối với các trục đường lớn như Đào Tấn, Linh Lang, Liễu Giai,... - Thiết kế chắc c...",
Bán nhà 100m2 Tân Chánh Hiệp 10 - Giá tốt nhất thị trường - 6.15 tỷ,"6,15 tỷ",100 m²,Hồ Chí Minh,"Bán gấp nhà hẻm 1/ Tân Chánh Hiệp 10 - vị trí đẹp, ở hoặc đầu tư đều tốt.Diện tích: 100m² ngang 5m đẹp.Kết cấu: 2 tầng.Pháp lý: Sổ hồng riêng, công chứng ngay.Giá bán: 6.15 tỷ (thương lượng).Liên hệ em Ngọc Kim 24/7, xem nhà thực tế - hỗ trợ pháp lý miễn phí.Em Ngọc Kim chuyên mua bán và cho thuê BĐS, dịch vụ thẩm định giá, thiết kế, thi công xây dựng, vay vốn ngân hàng.",
"Bom Tấn Apartment 8 tầng 1 hầm, ô tô tránh, dòng tiền 120tr/th, hàng bay trong tuần dưới 15 tỷ. Bấm","14,95 tỷ",50 m²,Hà Nội,"(ẢNH VÀ THÔNG TIN CHUẨN 100%)- Vị trí: Hồ Tùng Mậu, ô tô tránh, view Trường Học, Vinhomes. Vị trí 9.5/10đ, không quy hoạch.- 50m², 8 tầng 1 hầm, 8 phòng apartment cao cấp. Bên thứ 3 thầu 64tr/th, tự khai thác 120tr/th theo dạng airbnb !!!- Giá quá cả đầu tư: 14.95 tỷ. Mua xong lãi 3 tỷ.- Liên hệ: 0967 258 ***.",
"SIÊU PHẨM NHÀ LÔ GÓC 5 TẦNG VIỆT HƯNG NHỎ TIỀN, HIẾM HÀNG","5,6 tỷ",33 m²,Hà Nội,"Diện tích 33m  mặt tiền rộng 5.6m cực thoáng Thiết kế 5 tầng hiện đại, 3 phòng ngủ đủ công năng Nhà lô góc, trước cửa rộng, ánh sáng tràn ngập Khu dân cư đông đúc, an ninh tốt, ở sướng lâu dài Gần chợ, gần bệnh viện Đức Giang, khu đô thị Việt Hưng  tiện ích không thiếu thứ gì. Phù hợp khách mua ở thực lẫn đầu tư giữ tiền Liên hệ ngay để xem nhà!",
"Bán nhà đẹp khu VIP đường Lê Đức Thọ, nhà siêu đẹp chỉ hơn 7 tỷ. LH ngay 0902 812 ***","7,75 tỷ",48 m²,Hồ Chí Minh,"Bán nhà đẹp khu khu víp ở nghỉ dưỡng quá sướng.Trục đường lê đức thọ phường an hội tây gò vấp.Giá: 7,75 tỷ thương lượngHướng: Đông NamDiện tích : Ngang 4 dài 12mKết cấu: 1 trệt, lửng, 2 lầu, sân thượng, công năng gồm sân để xe máy, Gara xe hơi, phòng khách, phòng bếp, 4 phòng ngủ, 4 tolet, phòng giặt, sân thượng trước rộng rãiVi trí: 1 xẹc đường 8m có vỉa hè, khu phân lô đẹp tiện kinh doanh, sát bên công viên cây xanh, siêu thị, chợ, trường học, ...",
4.3 x 13m - Trệt 2 lầu ST - 4PN3WC - Huỳnh Tấn Phát Q7 - Nhà mới cứng ở ngay,"7,05 tỷ",56 m²,Hồ Chí Minh,"+ Nhà 1 trệt 2 lầu, ban công thoáng mát không gian xanh mát mắt. Nhà BTCT kiên cố ở ngay. - 3 Tâng: Phòng khách + bếp, 4 PN + 3 WC + Ban công thoáng mát. - Gần công an Phường Phú Thuận, VP Công cty, công viên trường học, khu dân trí. - Tiện ích đầy đủ. + Sổ hồng riêng, hoàn công đủ. Công chứng nhanh.",
"Nhà phố Nguyễn Cao ngõ kinh doanh cách ô tô 5m phù hợp mở VP, phòng khám, spa","17,5 tỷ",58 m²,Hà Nội,"Nhà trung tâm ngõ 31 Nguyễn Cao, Hai Bà Trưng, Hà Nội. Ace có thể đi theo ngõ 63 Nguyễn Cao rất gần. Vị trí đắc địa ngõ ô tô VF3 đỗ cửa Kinh doanh sầm uất tiềm năng sinh lời cao! Thông tin cơ bản: Diện tích sổ: 58m² thực tế: 65m². Mặt tiền: 4m nở hậu nhẹ phong thủy đẹp. Kết cấu: Nhà 3 tầng + 1 gác lửng, khung BTCT chắc chắn, có khe thoáng có thể cải tạo lắp thang máy. Chủ mới có thể lên thêm 12 tầng thoải mái. Hiện trạng thiết kế: - Tầng 1: Phòng...",
Nhà 3 tầng ngõ 109 Cam Lộ - Hồng Bàng - HP,"2,85 tỷ","43,5 m²",Hải Phòng,"Bán nhà 3 tầng xây cực chắc chắn ngõ 109 Cam Lộ - Hồng Bàng - HP DT: 43,6m² ngang 4,5m mặt ngõ rộng rãi, cách đường chính Cam Lộ chỉ vài chục mét Công năng sử dụng: - 1 phòng khách - 3 phòng ngủ - 1 phòng thờ - bếp ăn - sân phơi - WC đầy đủ Nhà xây chắc chắn, từ móng có hình ảnh đầy đủ. Tâm huyết từ chủ đảm bảo khách về ở cực kỳ yên tâm Tiện ích: Ngay gần chợ, trường học, uỷ ban trụ sở, ra Vin cũng rất gần, và ra khu vực trung tâm hành chính mới ...",
6 tầng thang máy gara oto - An Dương Vương - Q8 full nội thất - sổ riêng vuông - nhỉnh 8 tỷ TL,"8,18 tỷ",44 m²,Hồ Chí Minh,"Nhà thông minh - 6 tầng thang máy gara oto - An Dương Vương - Q8 full nội thất - sổ riêng vuông - nhỉnh 8 tỷ TL.Diện tích: 44m² (4 x 11). Diện tích sàn 215.6m². Hướng Đông Bắc. Kết cấu: Nhà 6 tầng lầu BTCT kiên cố, xây dựng theo kiểu nhà phố hiện đại, thông minh sử dụng hơn 30 thiết bị cảm ứng toàn căn nhà, cầu thang bộ được thiết kế sắp xếp rất tinh gọn và hệ thang máy đẳng cấp, xịn sò được người tiêu dùng lựa chọn hàng đầu. Nhà gồm 1 trệt + lửn...",
"Siêu phẩm biệt thự mini góc 2 mặt tiền, 3 lầu, xây mới 100%, hẻm đẹp khu cao cấp Lê Văn Sỹ, Quận 3","8,2 tỷ",45 m²,Hồ Chí Minh,"* Siêu phẩm biệt thự mini góc 2 mặt tiền, 3 lầu, xây mới 100%, hẻm đẹp khu cao cấp Lê Văn Sỹ, Phường 14, Quận 3.* Vị trí: Biệt thự mini tọa lạc vị trí tuyệt đẹp, góc 2 mặt tiền, khu nhiều cửa hàng thời trang, công ty, người nước ngoài sinh sống, trung tâm Quận 3 thuận tiện giao thông ra Trung Tâm Thành Phố và các Quận lân cận.* Tiện ích: Xung quanh đầy đủ tiện ích: Trường tiểu học, trung học, các nhãn hàng ngân hàng (Vietcombank, Viettin bank, AC...",
"Tuyệt phẩm nhà phố 03 tầng đẹp lung linh, full nội thất cao cấp hẻm xe hơi khu VIP Huỳnh Văn Bánh","5,95 tỷ",28 m²,Hồ Chí Minh,"Quận Phú Nhuận - Khu Vip.* Nhà hẻm xe hơi khu VIP Huỳnh Văn Bánh. * Vị trí: Hẻm 4m khu dân trí cao hiếm nhà đẹp, xe hơi sát nhà Huỳnh Văn Bánh thông khu Lê Văn Sỹ đắc địa. * Giá: 5,95 tỷ - Giảm lộc.* DT: 4m x 7m = 28m² công nhận đủ - Vuông A4. * Kết cấu: Trệt 2 lầu đúc BTCT kiên cố. * 3PN + 3 WC. * Ban công mỗi tầng thêm 6m² thoáng gió. * Trang thiết bị: Cao cấp.* LH Kiệt: 0903 604 ***. * Zalo: 0903 604 ***.",
"Siêu phẩm hầm, 4L, ST, thang máy (4,75x17m = 80,75m2) full NTCC đường nội bộ 12m khu vip 3 tháng 2","29,5 tỷ","80,75 m²",Hồ Chí Minh,"* Siêu phẩm hầm, 4 lầu, sân thượng (4,75m x 17m = 80,75m²) có thang máy, full nội thất cao cấp đường nội bộ 12m khu vip 3 Tháng 2, Phường 14, Quận 10.* Vị trí: Nhà tọa lạc vị trí tuyệt đẹp, đường nội bộ trước nhà 12m, khu vip Ba Tháng Hai, trung tâm Quận 10 thuận tiện giao thông ra trung tâm thành phố và các quận lân cận.* Tiện ích: Xung quanh đầy đủ tiện ích: Trường tiểu học, trung học, siêu thị Win, Co. Opmart, trung tâm thương mại Vạn Hạnh Mal...",
"Hạ giá! Bán nhà 38m2 xây 2 tầng đường Vũ Tùng,Bình Thạnh giá 2tỷ250.Gần chợ Bà Chiểu.Hẻm 5m.Sẵn sổ.",5 tỷ,38 m²,Hồ Chí Minh,"Diện tích: 38m² Kết cấu: 1 trệt 1 lầu có 3PN,2WC bao gồm ban công thoáng mát. Giá: 2 tỷ250. Nội thất bàn giao như hình. Sổ hồng riêng hoàn công đủVị trí: đường Vũ Tùng, Phường 2, Bình Thạnh  Hẻm 5m oto ra vào thoải mái. Chỉ 300m tới Chợ Bà Chiểu, 8 phút tới ngac tư hàng xanh,. Tiện di chuyển qua Q1, Q2,Phú Nhuận,. Nhà được san sửa cho thuê hay ở cực kỳ tốt. Xem Nhà Gọi 0792 389 *** Trà My.",
"Cần tiền bán gấp khách sạn Hạ Long Vũng Tàu view biển, sẵn dòng tiền giá tốt chỉ 20 tỷ bớt lộc",20 tỷ,97 m²,Bà Rịa Vũng Tàu (Hồ Chí Minh mới),"* Vị trí: Đường Hạ Long, Vũng Tàu khu du lịch sầm uất, sát biển. * Thông tin chi tiết: - Diện tích: 97m². - Kết cấu: Gồm 9 căn hộ cho thuê. - View: Biển cực đẹp, thoáng mát quanh năm. - Khoảng cách: Chỉ 50m đi bộ ra biển. * Khai thác sẵn: Đang cho thuê 25 triệu/tháng (dòng tiền ổn định). * Giá bán: 20 tỷ (thương lượng mạnh cho khách thiện chí). Phù hợp đầu tư khách sạn, căn hộ dịch vụ, homestay sinh lời cao. * Liên hệ ngay: Mr Tiến Thành 09865458...",
"31 m2*6T*7.78 tỷ, ngã 3 Nguyễn An Ninh, Trương Định, HM, thang máy, 0985 818 ***","7,88 tỷ",31 m²,Hà Nội,"31 m²*6T*7.78 tỷ, ngã 3 Nguyễn An Ninh, Trương Định, HM, thang máy, 0985 818 ***  Bán nhà Trương Định, Hoàng Mai: 31m²*6 tầng thang máy. * Diện tích 31 m²: Thiết kế 6 tầng, thang máy; hướng Tây, mt 3.3m. - Tầng 1          : Phòng khách. - Tầng 2,3,4    : Mỗi tầng 1 phòng, vệ sinh. - Tầng 5          : Bếp, phòng thờ. - Tầng 6          : Phòng thờ và sân phơi.  ( hiện nhà đang hoàn thiện, hình ảnh trên bài tham khảo)     --------------+ Vị trí đắc đị...",
Nhà siêu hiếm Tân Phú - sát Thoại Ngọc Hầu - 40m2 - 3 Tầng đúc - 4PN - Hẻm 4m Thông,"4,86 tỷ",40 m²,Hồ Chí Minh,"SIÊU HIẾM - KHÔNG CÓ CĂN THỨ 2+ Vị trí: Trần Quang Cơ sát Thoại Ngọc Hầu, Lũy Bán Bích, Nguyễn Lý, Thạch Lam + Diện tích: gần 40m² (ngang gần 4m); xây dựng cứng đúc 3 tấm, 4PN siêu hiếm ít nhà Tân Phú có, 2 PN, 2 sân trước sau thoáng mát quanh năm + Hẻm thông 2 đầu Trần Quang Cơ, Thoại Ngọc Hầu, rộng 4m, dân trí cao + ĐANG CHO THUÊ 10TR/THÁNG, hợp đồng 2 năm, có thể cho thuê 12tr/tháng nếu tái ký mới với mặt bằng cho thuê hiện tại + Pháp lý chuẩn...",
"Chính chủ tôi, kẹt tiền bán gấp nhà biệt thự 5T kiên cố ô tô vào nhà 184m2 rẻ hơn khu vực 15% - 20%","36,5 tỷ",184 m²,Hà Nội,"Giáp Nhất Thanh Xuân | ô tô vào nhà | kinh doanh CCMN. Diện tích lớn mặt tiền rộng sổ nở hậu. Giáp Nhất Thanh Xuân. Giá: 36,5 tỷ. Nhà 5 tầng thiết kế biệt thự sân vườn. Điểm mạnh nổi bật: Ngõ ô tô vào nhà, trước nhà sân chơi rộng, thoáng sáng. Sau nhà ngõ thông, lưu thông thuận tiện. Khu vực kinh doanh sầm uất, ở kết hợp làm ăn rất tốt. Kết cấu chắc chắn, 6 phòng ngủ, không gian rộng rãi. Phù hợp xây CCMN / khai thác dòng tiền cực ổn. Sổ đỏ chính...",
"Bán nhà quận 7 mới sửa sang, chỉ 2,2 tỷ","2,2 tỷ",47 m²,Hồ Chí Minh,"Bán nhà quận 7 mới sửa sang, chỉ 2,2 tỷ.Bạn đang tìm một căn nhà nhỏ xinh, giá vừa túi tiền tại quận 7 để an cư hoặc đầu tư? Đây là lựa chọn cực hiếm trong tầm giá!Thông tin căn nhà:Diện tích sử dụng thực tế: 47m² bố trí hợp lý, không gian rộng rãi hơn mong đợi. Kết cấu 2 tầng chắc chắn (Có hình ảnh thực tế quá trình thi công). 2 phòng ngủ + 2 WC tiện nghi cho gia đình trẻ. Hướng Đông, phong thủy tốt, nhà luôn thoáng mát. Vừa cải tạo mới cực đẹp,...",
"Nhà đẹp full nội thất 42m2 x 6 tầng, tại Ngô Thì Nhậm, Hà Đông - Ô tô sát cửa - Giá tốt 9tỷ.",9 tỷ,42 m²,Hà Nội,"Nhà đẹp full nội thất 42m² x 6 tầng, tại Ngô Thì Nhậm, Hà Đông - Ô tô sát cửa. Nhà xây 6 tầng full nội thất đẹp chủ hoàn thiện tâm huyết: 5 phòng ngủ, 1 phòng thờ, 3 vệ sinh. Nhà nằm tại vị trí trung tâm Phường Hà đông gần đường Ngô Thì Nhậm, Phần Đình giót. Tiện ích gần trường học, sát chợ La Khê Bông đỏ.Giá tốt: 9 tỷ. Quý khách quan tâm liên hệ: Trần Lực 0987 765 ***. Xem nhà miễn phí và gặp ngay chủ thiện Chí.",
"Nhà 5,5T thang máy Vị Trí Đẹp sát MP khu P/Lô Nguyễn An Ninh hai thoáng ngõ 2,5m vừa ở vừa kd tốt","16,8 tỷ",53 m²,Hà Nội,"- Bán căn nhà 5,5 tầng thang máy Vị Trí Đẹp sát mặt phố trong khu Phân Lô Víp Nguyễn An Ninh- Khu phân lô cán bộ công chức ngành giáo dục nên dân trí cao,yên tĩnh,văn minh,an ninh tốt.Hệ thống đường xá cống ơi thoát nước rất tốt nên dù mưa bão to nhất vừa qua nhưng đường ko giờ bị ngập   - Xung quanh rất nhiều tiện ích như chợ,nhà thi đấu Hoàng Mai, trường mầm non 10/10,trường mẫu giáo Tương Mai,trường Tân Định.Rất thuận tiện đi lại.-  Đường ô bà...",
Cấn bán nhá 40m2 nhá xây 5 tầng phố An Dương Tây Hồ,"15,4 tỷ",40 m²,Hà Nội,"Cần bán nhà ngõ 1 phố An Dương Lạc Long Quân Tây Hồ. DT 40m² MT 4m xây 5 tầng. Thiết kế hiện đại nội thất nhập khẩu đường ô tô đỗ cửa gần hồ Tây phố đi bộ. Sổ đỏ chính chủ. Giá 15,4 tỷ. LH: 0985 052 ***.",
Cách Hoàng Diệu 2 chỉ 30m  NHÀ ĐẸP  CÓ DÒNG TIỀN SẴN,15 tỷ,81 m²,Hồ Chí Minh,Giá 15 tỷ HĐ thuê: 30tr/tháng  18 Đường số 4  khu Him Lam Khu dân cư đẹp  yên tĩnh  ở cực ổn - Nhà phù hợp: Ở gia đình Tự kinh doanh Vừa ở vừa có thu nhậpLH MR HUY: 0797 232 ***,
Bán nhà Phú Thượng Tây Hồ - Ngõ rộng 3 m thông - Ô tô vào nhà - 81 m - 3.5 tầng - Nhà mới xây đẹp.,"15,5 tỷ",81 m²,Hà Nội,"Nhà dân xây 3,5 tầng kiểu biệt thự rất đẹp. Ngõ thông, ô tô vào được nhà. Tặng lại nội thất cơ bản, đồ liền tường.Vị trí cực đẹp: - Rất gần trường, gần chợ nên tiện ích đầy đủ. - Gần các trục đường chính vành đai 1, 2, 3. - Dân cư văn minh, yên tĩnh, hạ tầng đồng bộ, an ninh đảm bảo. - Tiềm năng tăng giá rất cao nên mua để ở hay đầu tư đều ổn.Thiết kế: - Tầng 1: Phòng khách + Bếp + WC. - Tầng lửng: Phòng đa năng. - Tầng 2: 2 phòng ngủ khép kín. -...",
Chủ cần bán gấp giá tốt nhất khu vực chốt nhanh trong tuần. Không nên bỏ qua cơ hội vàng,"3,4 tỷ",53 m²,Khánh Hòa,"HÀNG HIẾM GIÁ RẺ NHẤT KHU VỰC  NHÀ HẺM Ô TÔ HAI THÁNG TƯ CHỈ 3,4 TỶCơ hội sở hữu căn nhà giá tốt nhất khu vực đường Hai Tháng Tư, vị trí thuận tiện, khu dân cư văn minh  an ninh cao. Thông tin căn nhà: 		Địa chỉ: Hẻm 77/120 đường Hai Tháng Tư 		Đường trước nhà: 4m  ô tô ra vào thoải mái 		Mặt tiền: 4,1m 		Diện tích sử dụng: 53m² 		Diện tích thực tế: 62,7m² Ưu điểm nổi bật:  Gần Trường Công nghệ Thông tin của khu quân đội, khu vực dân trí cao, an...",
"Bán nhà Phố Thuỵ Khuê, dt55m, 7 tầng thang máy, ô tô lùi cửa, View triệu đô Hồ Tây.",27 tỷ,55 m²,Hà Nội,"THUỴ KHUÊ- DÂN XÂY- 7 TẦNG THANG MÁY- OTO 5 TẠ LÙI CỬA-  VIEW TRIỆU ĐÔ HỒ TÂY.            - Dt55m- 27 tỷ. - Sổ đỏ đẹp, pháp lý chuẩn. - Vị trí rất đẹp, vài bước chân ra Hồ Tây, gần trường học cấp 2,3 Chu Văn An, khu vực đa tiện ích. Dân trí cao, an ninh tốt. - Giao thông di chuyển Thuỵ Khuê, Quán Thánh, Phan Đình Phùng, đường Thanh Niên, Trích sài.- Thiết kế 7 tầng, Thang máy, thang bộ Hệ thống phòng cháy chữa cháy đầy đủ. - Tầng 1: Thang máy, th...",
BÁN NHÀ ĐẸP Ở NGAY.DT 4mX15M. 3 TẤNG BTCT . HẺM NHỰA THÔNG DƯỜNG TRƯỜNG CHINH .NGAY KHU BÀU CÁT,"8,5 tỷ",60 m²,Hồ Chí Minh,"GIẢM SỐC CHỈ CÒN 8,5 TỶ | NHÀ ĐẸP  VỊ TRÍ VÀNG ETOWN  LĂNG CHA CẢ  NHÀ HẺM NHỰA XE HƠI TRƯỜNG CHINH  P. TÂN BÌNH  HẺM 5M THÔNG  Ở NGAY Giá: 8,5 tỷ (thương lượng khách thiện chí) Diện tích: 4m x 15m  vuông vức  Kết cấu: 1 trệt 2 lầu BTCT  Công năng: 3PN  3WC Ưu điểm nổi bật:  Nhà mới xây, thiết kế hiện đại  dọn vào ở ngay  Nội thất cao cấp, thiết bị điện Panasonic  Tủ bếp, cửa gỗ chắc chắn, hoàn thiện kỹ  Hẻm 5m thông thoáng, xe hơi vào tận nhà Vị...",
Bán nhà HXH 3/2 Ngay Nhà Hát Hoà Bình. Nhà đầy đủ nội thất Cao cấp. Giá siêu hời,"14,86 tỷ",61 m²,Hồ Chí Minh,"Nhà riêng Đường 3/2, Phường Vườn Lài. Ngay Nhà Hát Hoà Bình - Diện tích CN: 61m² - Kết cấu: 1 trệt 2 lầu, Sân thượng - 4 phòng ngủ (PN) và 4 phòng tắm (WC) đầy đủ tiện nghi, không gian sống thoáng đãng. - Giá 14 tỷ 860tr - 2 tầng, mặt tiền rộng 6m, hướng Tây Nam, thích hợp cho gia đình hoặc kinh doanh. - Ngõ vào rộng 6m, thuận tiện cho ô tô di chuyển. - Nội thất đầy đủ với điều hòa, giường, tủ lạnh, mang lại sự tiện nghi tối đa. - Pháp lý đầy đủ,...",
"Bán đất tại Rừng Sác, 17 triệu / m², 996.2 m², có 300m² Thổ, hàng hiếm uy tín LH 0906 819 ***","16,93 tỷ","996,2 m²",Hồ Chí Minh,"Nhanh tay sở hữu căn nhà riêng độc đáo tại lô nhì Đường Rừng Sác, Xã An Thới Đông, Hồ Chí Minh - Huyện Cần Giờ, Hồ Chí Minh cũ.  - Diện tích rộng lớn 996.2m², có 300m² thỏi cư ,giá chỉ 17 triệu / m².  - Pháp lý đầy đủ, đảm bảo an tâm cho khách hàng.  - Mặt tiền rộng 15 m², thuận lợi cho việc kinh doanh.  - Đường vào rộng 6 m², dễ dàng cho xe ô tô ra vào.  - Phong thủy tốt, mang lại may mắn cho gia chủ.  - Không gian sống thoáng đãng, phù hợp cho ...",
Duy Nhất 1 Căn Đối Diện Khuân Viên MiNi Khu Út Tịch Tân Bình,"14,9 tỷ",56 m²,Hồ Chí Minh,"- Bán nhà khu Út Tịch Hoàng Việt, phường 4, Tân Bình.Duy nhất 1 căn Đối diện khuân viên Mini giao bán.- Diện tích: 56m² ( 3,5m x 15m )sổ vuông đẹp, không lỗi phong thuỷ, không lộ giới.- Kết cấu: 3 tầng BTCT, sân xe ô tô, phòng khách và bếp rộng thoáng, cải tạo được 1 PN tầng trệt, trên lầu 3 phòng ngủ lớn, phù hợp làm văn phòng, làm CHDV cho thuê rất tốt.- Vị trí: đường xe hơi thông thoáng, ngay đường Hoàng Việt, Út tịch, Lê Bình, Hoàng Văn Thụ, ...",
Giảm giá - Bán gấp nhà hẻm xe hơi - 2 tầng diện tích 40m2 - Phạm Văn Chiêu - Gò Vấp - HCM,"4,97 tỷ",40 m²,Hồ Chí Minh,"Bán nhà hẻm xe hơi vô tận cửa Vị trí: Phạm Văn Chiêu, P9, Quận Gò Vấp, HCM DT: 4x10 công nhận đủ Nhà mới keng đầy đủ nội thất xách vali vô ở. Vị trí: Gần chợ, trường học các cấp, siêu thị, nhà thờ.. Dòng tiền hàng tháng: 11tr/tháng",
"Bán nhà đường Lý Thái Tông, DT 60m2, ngang 11m, vài bước ra biển Nguyễn Tất Thành. Giá tốt: 3tỷ4 TL","3,4 tỷ",60 m²,Đà Nẵng,"Bán nhà kiệt Lý Thái Tông - Mặt tiền rộng 11m - Ngay trung tâm du lịch biển Thanh Khê - Ở hoặc cho thuê rất thuận tiện. DT 60m², ngang 11m (đường kiệt rộng rãi, thông suốt các tuyến đường chính). Nhà c4 đang sẵn có dòng tiền. Vị trí: Ngay phố ẩm thực du lịch biển Thanh Khê, gần trường học, siêu thị, chợ, Bv, bãi tắm trãi dài trong xanh, gần các dãy nhà hàng và khách sạn. Nhà gần biển mà giá chỉ nhỉnh hơn 3 tỷ TL. Anh Chị mua tích trữ cho thuê, ho...",
"Bán nhà 2 tầng kiệt Nguyễn Đình, DT 75m2, ngang 5m. Ngay Vương Thừa Vũ, chỉ vài bước chân đến biển","6,6 tỷ",75 m²,Đà Nẵng,"Bán nhà kiệt 2 tầng đường Nguyễn Đình, ngay trục Vương Thừa Vũ, gần 2 tòa Sun Costa Residence - Chỉ 3 phút đi bộ ra biển Phạm Văn Đồng. Diện tích đất 75m², ngang 5m (nở hậu tài lộc). - Đường kiệt nối thẳng ra nhiều trục chính. - Nhà rất mới chắc chắn, còn để trống chưa vô nội thất, thuận tiện decor theo cách riêng. - Ngay trục thông biển Vương Thừa Vũ rất hiếm có nhà kiên cố chắc chắn mà giá chỉ nhỉnh 6 tỷ thương lượng tốt. - Nhà ở hoặc cho thuê ...",
"Giật mình! Tu Hoàng, lô góc 55m2, vài bước ra ô tô, sổ vuông đẹp, MT rộng, giá tốt chỉ 7 tỷ",7 tỷ,55 m²,Hà Nội,"Chủ cần bán gấp, giá tốt!Diện tích 55m², xây 4 tầng dân xây chắc chắn. Lô góc thoáng sáng.Vài mét ra ô tô, ngõ rộng dễ đi lạiSổ đỏ vuông đẹp, pháp lý chuẩnGiá chỉ nhỉnh 7 tỷLiên hệ Mr Chung 0862 565 *** xem nhà miễn phí.",
"Hot deal đầu tư, biệt thự 2 MT đường, Bình Quới Thanh Đa, P. 27, Bình Thạnh, kế Masterise Thanh Đa",42 tỷ,398 m²,Hồ Chí Minh,"Hot deal đầu tư - Bình Quới Thanh Đa, P. 27, Bình Thạnh, kế DA Masterise Thanh Đa - Biệt thự 2 mặt tiền đường lớn 398m² chỉ 42tỷ TL.- DT: 12m x 32m (398m²). - Kết cấu: 3 tầng 6PN, 5WC.- Vị trí đắc địa: Khu biệt thự cao cấp Thanh Đa, khu vực cao ráo không bị ngập, kế bên DA Masterise Thanh Đa Peninsula. 2 Mặt tiền đường 12m, Khu phân lô đồng bộ cực kỳ lịch sự. Một bước chân triệu tiện ích, thiên đường ẩm thực bờ sông...- Đặc biệt: Cơ hội 3x tài sả...",
